93,https://www.airbnb.com/rooms/271647,06/03/2023,previous scrape,"Private Room w/ 2 Queen Beds, Steps to Ocean Beach","Comfortable Queen Size Bed in Shared Bedroom. Across street from Ocean Beach and 5 blocks to Golden Gate Park. 3 blocks to the N line train. 1 block to the #7 bus. <br /><br />Our beautiful neighborhood gives you easy access to both nature and city.<br /><br />Nice kitchen, granite counter tops, stainless steel appliances, hardwood floors, free laundry, 45mbs internet. <br /><br />Our home is comfortable and convenient.<br /><br />Calendar is open for January, but we are open to longer term renters as well.<br /><br /><b>The space</b><br />Stay in the SURF ROOM in our beautiful,  modern and comfortable three bedroom flat, located one block from the beach, in the heart of Ocean Beach.  This is a safe and quite neighborhood located along the western edge of San Francisco, where the City meets the Sea.<br /><br />We are conveniently located:<br />- 1 block from the middle of Ocean Beach<br />- 1 block off of the shops on Noriega (Organic Produce, Pizza, Korean food, Mexican food etc...),<","This neighborhood is San Francisco's best kept secret.  Quiet, but within a quick commute to all of the hustle and bustle of downtown, Ocean Beach revolves around two main places -- 5 miles of beach fronting the Pacific Ocean and Golden Gate Park, one of the best urban parks in the country.",https://a0.muscache.com/pictures/9f82d2db-8cbd-4084-a8d9-de882ace61de.jpg,https://www.airbnb.com/users/show/1421509,Matthew,18/11/2011,"San Francisco, CA","I am a political theorist, a privacy advocate, a big wave surfer and an innovation coach.  You can learn more about both my work and my play by looking for my blog online.  Airbnb doesn't allow you to list websites but you can search for it: my name is Matthew Schutte. And my blog is: ""Matthew Schutte  |  on the future of the internet and society, with a dash of surfing and play""",sin registro,sin registro,sin registro,f,https://a0.muscache.com/im/pictures/user/3bd4cf1b-8a7a-4473-aeae-ad9d7f4722f8.jpg?aki_policy=profile_small,https://a0.muscache.com/im/pictures/user/3bd4cf1b-8a7a-4473-aeae-ad9d7f4722f8.jpg?aki_policy=profile_x_medium,Sunset District,"['email', 'phone']",t,t,"San Francisco, California, United States",Outer Sunset,Private room in rental unit,Private room,1.5,"[""Essentials"", ""Carbon monoxide alarm"", ""Free street parking"", ""Hangers"", ""Iron"", ""Shampoo"", ""Lock on bedroom door"", ""Washer"", ""Hair dryer"", ""Smoke alarm"", ""Fire extinguisher"", ""Dryer"", ""Wifi"", ""Heating"", ""Kitchen""]",$60.00,t,06/03/2023,01/10/2012,14/02/2021,STR-0000202,f,271647,20200000000000.0,1421509.0,2.0,3.3,37.75334,-122.4,2.0,1.0,2.0,30.0,185.0,30.0,30.0,185.0,185.0,30.0,185.0,0.0,0.0,0.0,0.0,135.0,0.0,0.0,4.54,4.9,4.49,4.81,4.8,4.68,4.47,2.0,1.0,2.0,0.0,1.06
99,https://www.airbnb.com/rooms/273530,06/03/2023,previous scrape,"Sunny Potrero Townhouse ""Nest""","Two comfortable, quiet guest rooms and two private baths in well-appointed and stylish townhouse. On top of one of the famous SF Hills, in the desirable Potrero Hill neighborhood. Great views! Easy transportation & street parking.<br /><br /><b>The space</b><br />A sunlit filled contemporary, comfortable townhouse with two bedrooms, and two bathrooms (master bedroom with bath en suite). All at the tippy top of Potrero Hill with incredible views overlooking the City. Bamboo hardwood floors throughout. Gas stove, dishwasher, washer/dryer in unit, WiFi, cable. Quiet and interesting neighborhood, with easy street parking, close to great restaurants (Chez Papa, Plow, Mochico, Piccino, Serpentine, etc...), shops (Whole Foods, Good Life Grocery, Chiotras Market, etc...), and public transportation (SF Muni Lines 10, 19, 48, and 22) and the CalTrain at Pennsylvania & 22nd Street). Near the UC Mission Bay, CCA (Calif. College of Arts), easy proximity to the Mission, Dogpatch, SOMA, downtown SF, ","Potrero Hill has the best weather and views in San Francisco. I like the feeling of being a bit in the country (many trees, birds), but also really being in the City. There are excellent restaurants nearby (mostly on 18th Street, or at the foot of the hill in the ""Dogpatch"" neighborhood), as well as some lovely unique small shops.",https://a0.muscache.com/pictures/2760799/71e474a8_original.jpg,https://www.airbnb.com/users/show/99128,Cathryn,26/03/2010,"San Francisco, CA","Mature but young at heart (and fully vaccinated). Interested in the arts, music, good food, the outdoors, and all that Northern California has to offer. Longtime resident and very knowledgeable about where to go, what to see & do in and around San Francisco Bay Area. ",within an hour,100%,98%,t,https://a0.muscache.com/im/users/99128/profile_pic/1269579142/original.jpg?aki_policy=profile_small,https://a0.muscache.com/im/users/99128/profile_pic/1269579142/original.jpg?aki_policy=profile_x_medium,Potrero Hill,"['email', 'phone']",t,t,"San Francisco, California, United States",Potrero Hill,Entire condo,Entire home/apt,2.0,"[""Cooking basics"", ""Shampoo"", ""Smoke alarm"", ""Patio or balcony"", ""Kitchen"", ""Carbon monoxide alarm"", ""Dishes and silverware"", ""Hangers"", ""Dedicated workspace"", ""TV with standard cable"", ""Washer"", ""Hot water"", ""Refrigerator"", ""Wifi"", ""Heating"", ""Iron"", ""First aid kit"", ""Indoor fireplace"", ""City skyline view"", ""Essentials"", ""Free street parking"", ""Coffee maker"", ""Hair dryer"", ""Fire extinguisher"", ""Dryer""]",$316.00,t,06/03/2023,23/11/2013,21/07/2022,STR-0000036,f,273530,20200000000000.0,99128.0,2.0,3.0,37.75533,-122.39927,4.0,2.0,2.0,4.0,7.0,4.0,4.0,7.0,7.0,4.0,7.0,0.0,0.0,0.0,0.0,35.0,1.0,0.0,4.91,5.0,4.8,4.91,4.94,4.89,4.83,2.0,1.0,1.0,0.0,0.31
102,https://www.airbnb.com/rooms/279184,06/03/2023,previous scrape,Stay in a historic apt in the heart of the Mission,"You'll love staying in our three bedroom, two bath apartment located on the top floor of a 1902 Edwardian building. It's private and all yours. In the heart of the Mission District with murals, shops, cafes, restaurants, and bars -- all within easy walking distance. And a 5 minute walk from the 24th BART station!<br /><br /><b>The space</b><br />Large 3 bedroom, 2 bathroom apartment on the top floor of classic 2 floor Edwardian. Includes:<br /><br />â€¢ Big sunny kitchen and dining room gets lots of morning light. Overlooks backyard. Stairs from dining room lead down to backyard.<br />â€¢ Living Room has a gas fireplace.<br />â€¢ Front and back bedroom have queen beds.<br />â€¢ Middle bedroom has a solid wood bunkbed with a single bed on top and a full/double sized bed on the bottom. The bottom bed would probably be too small for 2 adults but fine for 2 children.<br />â€¢ Office with two workstation areas or just extra space.<br /><br />â€¢ Fully furnished - hardwood floors<br />â€¢ Top floor - sunn","The apartment is on Shotwell St next to 24th St corridor (and very close to Mission and Valencia streets) with lots of shops, coffee shops, restaurants, bars and the famous Balmy Alley murals. Easy walking distance to everything you need - grocery stores, several parks, and Bernal Hill for amazing views of San Francisco. 5 minute walk to 24th St BART Station which is a  couple of blocks away.",https://a0.muscache.com/pictures/1fa6a996-e092-43c9-ae02-355861f980f7.jpg,https://www.airbnb.com/users/show/1456262,Justin,30/11/2011,"San Francisco, CA",Our San Francisco airbnb listing is 279184.,sin registro,sin registro,95%,t,https://a0.muscache.com/im/users/1456262/profile_pic/1322641799/original.jpg?aki_policy=profile_small,https://a0.muscache.com/im/users/1456262/profile_pic/1322641799/original.jpg?aki_policy=profile_x_medium,Mission District,"['email', 'phone']",t,t,"San Francisco, California, United States",Mission,Entire rental unit,Entire home/apt,2.0,"[""Oven"", ""Self check-in"", ""Window guards"", ""Cooking basics"", ""Shampoo"", ""TV"", ""Smoke alarm"", ""Room-darkening shades"", ""Kitchen"", ""Carbon monoxide alarm"", ""Dishes and silverware"", ""Hangers"", ""Bathtub"", ""Dedicated workspace"", ""Microwave"", ""Hot water"", ""Refrigerator"", ""Backyard"", ""Wifi"", ""Heating"", ""Long term stays allowed"", ""BBQ grill"", ""Dishwasher"", ""Children\u2019s books and toys"", ""Iron"", ""First aid kit"", ""Stove"", ""Indoor fireplace"", ""Essentials"", ""Baby safety gates"", ""Coffee maker"", ""Hair dryer"", ""Fire extinguisher"", ""Lockbox""]",$550.00,t,06/03/2023,03/01/2012,03/07/2019,STR-0002616,f,279184,20200000000000.0,1456262.0,2.0,3.0,37.75059,-122.41415,7.0,3.0,1.6,4.0,365.0,4.0,4.0,365.0,365.0,4.0,365.0,0.0,0.0,0.0,0.0,13.0,0.0,0.0,4.85,4.92,4.69,5.0,4.85,4.62,4.77,2.0,1.0,0.0,0.0,0.1
107,https://www.airbnb.com/rooms/280549,06/03/2023,city scrape,Bungalow Rooms with Great Views,"Sharing our home with travelers from around the world is a singular joy. We are in a quiet residential area,  just a ten minute walk from a quality vintage market, Starbucks, a bakery, a fine burger place and other shops. The eastern views of San Francisco Bay and Mount Davidson to the west add a calm to life here.<br /><br /><b>The space</b><br />We have two downstairs bedrooms with Bay views in a charming 1940's house on Mt. Davidson in the quiet Miraloma Park area of the city. We share the house with our guests, but it is arranged to assure your privacy. <br /><br />Each bedroom has access to a large deck and lovely garden. There is a half-bath in the larger room with a queen bed. The second bedroom is a study with a twin bed. Workspaces are available in both rooms. Shower and bath are in the upstairs bathroom. Both bedrooms offer sweeping vistas to the East Bay.<br /><br />There is Internet access and more street parking than almost anywhere in the city! We find pleasure in chattin",sin registro,https://a0.muscache.com/pictures/3027575/aa796ae6_original.jpg,https://www.airbnb.com/users/show/1454829,Luise,29/11/2011,"San Francisco, CA","Life is a rich, complex affair. I wander the landscape taking notes. Easy-going, politically curious and delighted to share corners of San Francisco. Have spent time studying and working in Germany and Guatemala. Passions run toward human rights and disability work, though taught for years at San Francisco City College.",sin registro,sin registro,100%,f,https://a0.muscache.com/im/users/1454829/profile_pic/1343754897/original.jpg?aki_policy=profile_small,https://a0.muscache.com/im/users/1454829/profile_pic/1343754897/original.jpg?aki_policy=profile_x_medium,Sunnyside,"['email', 'phone']",t,t,sin registro,West of Twin Peaks,Private room in home,Private room,1.5,"[""Luggage dropoff allowed"", ""Shampoo"", ""Smoke alarm"", ""Patio or balcony"", ""Dishes and silverware"", ""Hangers"", ""Dedicated workspace"", ""Microwave"", ""Washer"", ""Hot water"", ""Refrigerator"", ""Backyard"", ""Wifi"", ""Heating"", ""Long term stays allowed"", ""Iron"", ""Essentials"", ""Coffee maker"", ""Breakfast"", ""Hair dryer"", ""Fire extinguisher"", ""Dryer""]",$250.00,t,06/03/2023,09/07/2013,27/09/2022,STR-0000352,f,280549,20200000000000.0,1454829.0,1.0,2.0,37.73948,-122.44947,3.0,2.0,2.0,1.0,144.9,1.0,1.0,1125.0,1125.0,1.0,1125.0,0.0,26.0,56.0,331.0,36.0,1.0,0.0,4.71,4.76,4.76,4.91,4.91,4.56,4.53,1.0,1.0,1.0,0.0,0.31
113,https://www.airbnb.com/rooms/314248,06/03/2023,city scrape,Pacific Heights 3 bedroom home with garage,"<b>The space</b><br />S.F. Res. Rental Reg.# STR-0000133 <br /> Light filled Pacific heights home with three spacious bedrooms is located one block away from Fillmore with trendy restaurants and upscale boutiques.  Two blocks away is Alta Plaza Park with a wonderful playground and tennis courts. The Kabuki  is a multi cinema comlex six blocks away.<br />   There is easy public transportation to downtown and the financial district. Just down the hill you are at the bay, where you can walk out to the Golden Gate bridge or rent bikes.<br />   The house is in a perfect residential location within an exciting city.  The wine country is an hour from the city.  It is a four hour drive to the mountains.<br /><br /><b>License number</b><br />STR-0000133","The neighborhood is lively with boutiques and a choice of many restaurants. Close by are all the amenities  such as grocery store, drug store, banks and cinemas.",https://a0.muscache.com/pictures/3545178/acdb223f_original.jpg,https://www.airbnb.com/users/show/1614566,Sarah,16/01/2012,"San Francisco, CA",I am 65 and manage family property with my brother  so my time is flexible.  I teach watercolor on cruises at least once a year.  I studied art and French at Berkeley and taught Jr. High Art. I have three grown children and three grandchildren all living in The Bay Area.,within a few hours,100%,71%,t,https://a0.muscache.com/im/users/1614566/profile_pic/1327637570/original.jpg?aki_policy=profile_small,https://a0.muscache.com/im/users/1614566/profile_pic/1327637570/original.jpg?aki_policy=profile_x_medium,Pacific Heights,"['email', 'phone']",t,t,"San Francisco, California, United States",Pacific Heights,Entire home,Entire home/apt,2.5,"[""Essentials"", ""Indoor fireplace"", ""Carbon monoxide alarm"", ""Dishes and silverware"", ""Cooking basics"", ""Iron"", ""Shampoo"", ""TV"", ""Free parking on premises"", ""Washer"", ""Hot water"", ""Hair dryer"", ""Smoke alarm"", ""Dryer"", ""Wifi"", ""Heating"", ""Kitchen""]",$525.00,t,06/03/2023,03/11/2013,03/10/2022,STR-0000133,f,314248,20200000000000.0,1614566.0,1.0,1.0,37.78946,-122.43538,6.0,3.0,1.6,7.0,365.0,7.0,7.0,365.0,365.0,7.0,365.0,8.0,17.0,41.0,301.0,58.0,8.0,0.0,4.86,4.86,4.61,4.93,4.96,4.89,4.67,1.0,1.0,0.0,0.0,0.51
114,https://www.airbnb.com/rooms/663623,06/03/2023,city scrape,Grand victorian flat in mission SF,"<b>The space</b><br />Amazing, large, bright, grand victorian queen anne flat with round windows, columns, nice furnishings, baby grand piano, 2 bedrooms plus sleeping for another 2 (one of the bedrooms is huge and has a pullout futon plus another small futon.) <br /><br />The flat has everything, stainless steel appliances + dishwasher in a large kitchen, shared laundry (not coin op) off the outside lovely shared sunny courtyard. Flat has 1 and 1/2 baths. <br /><br />Easy to get downtown by one bus (10 min.) <br /><br />I have 2 cats but when I book the flat they stay at my daughter's apartment, not here. No animals in this flat, and all is professionally cleaned however there could be some lingering cat dander.<br /><br />Wifi and TV with Netflix, Amazon prime etc. included.<br /><br />Fun mission district area with endless new restaurants, cafes, bars, etc. Lots of sun!<br /><br /><b>Guest access</b><br />Whole flat is yours privately.<br /><br /><b>Other things to note</b><br />I c","Fabulous inner mission neighborhood with cafes, restaurants, bars and bookstores all within a few blocks walk. Easy to get downtown as well by bus and easy to walk to BART. Tree lined beautiful street.",https://a0.muscache.com/pictures/8689639/6ad84a75_original.jpg,https://www.airbnb.com/users/show/119920,Gwen,07/05/2010,"San Francisco, CA",I am a painter in SF and also have a graphic design business doing package design. ,within a day,67%,38%,f,https://a0.muscache.com/im/pictures/user/a88e8601-e491-41e3-8cfd-25109d82f215.jpg?aki_policy=profile_small,https://a0.muscache.com/im/pictures/user/a88e8601-e491-41e3-8cfd-25109d82f215.jpg?aki_policy=profile_x_medium,Mission District,"['email', 'phone', 'work_email']",t,t,"San Francisco, California, United States",Mission,Entire rental unit,Entire home/apt,1.5,"[""Oven"", ""Cooking basics"", ""Shampoo"", ""Host greets you"", ""Kitchen"", ""Bed linens"", ""Dishes and silverware"", ""Extra pillows and blankets"", ""Hangers"", ""Bathtub"", ""TV with standard cable"", ""Microwave"", ""Hot water"", ""Refrigerator"", ""Backyard"", ""Private patio or balcony"", ""Wifi"", ""Heating"", ""Long term stays allowed"", ""Dishwasher"", ""Iron"", ""First aid kit"", ""Stove"", ""Essentials"", ""Free street parking"", ""Coffee maker"", ""Piano"", ""Hair dryer"", ""Private entrance"", ""Fire extinguisher""]",$240.00,t,06/03/2023,12/08/2014,03/02/2023,STR-0001506,f,663623,20200000000000.0,119920.0,1.0,5.0,37.7562,-122.40944,5.0,2.0,2.0,2.0,85.0,2.0,2.0,85.0,85.0,2.0,85.0,2.0,2.0,4.0,234.0,43.0,7.0,0.0,4.9,4.93,4.69,4.98,5.0,4.83,4.79,1.0,1.0,0.0,0.0,0.41
122,https://www.airbnb.com/rooms/326650,06/03/2023,city scrape,Lovely beautiful Apt Pac Fillmore,"<b>The space</b><br />CLOSE TO ATTRACTIONS. 25MIN WALK TO UNION SQUARE.<br /><br />BRIGHT. FURNISHED. TOP OF THE LINE APPLIANCES IN KITCHEN.<br /><br />HIGH END QUEEN SIZE MATTRESS<br /><br />VIEW OF THE SKY FROM ALL ROOMS. <br /><br />SOUTH FACING SO GETS A LOT OF DIRECT SUN LIGHT.<br /><br />MODERN. <br /><br />BUS LINES: 1,2,3,4,22,38<br /><br />CENTRAL<br /><br />NEAR ALL THE SHOPS ON FILLMORE STREET<br /><br />2 MOVIE THEATRES ON BLOCK<br /><br />FOOT STEPS TO SAFEWAY, STARBUCKS, MOLLIE STONE, WALGREENS, BUS LINES, CAFES, RESTAURANTS<br /><br />WALK SCORE: 100","It's in lower pacific heights near Fillmore street. There is a movie theatre, restaurants, cafes, grocery stores at your door step.",https://a0.muscache.com/pictures/3543192/2626a084_original.jpg,https://www.airbnb.com/users/show/1670339,Je,29/01/2012,"San Francisco, CA","Flexible, considerate, clean, ethical
",a few days or more,0%,0%,f,https://a0.muscache.com/im/users/1670339/profile_pic/1403339684/original.jpg?aki_policy=profile_small,https://a0.muscache.com/im/users/1670339/profile_pic/1403339684/original.jpg?aki_policy=profile_x_medium,Japantown,"['email', 'phone']",t,t,"San Francisco, California, United States",Western Addition,Entire rental unit,Entire home/apt,1.5,"[""Essentials"", ""Indoor fireplace"", ""Elevator"", ""Shampoo"", ""TV"", ""Dedicated workspace"", ""Washer"", ""First aid kit"", ""Dryer"", ""Wifi"", ""Heating"", ""Kitchen""]",$189.00,t,06/03/2023,01/06/2012,07/08/2015,sin registro,f,326650,20200000000000.0,1670339.0,2.0,7.0,37.78457,-122.43177,2.0,1.0,1.0,30.0,180.0,30.0,30.0,180.0,180.0,30.0,180.0,30.0,60.0,90.0,365.0,32.0,0.0,0.0,4.7,4.75,4.53,4.94,5.0,4.75,4.72,2.0,1.0,1.0,0.0,0.24
125,https://www.airbnb.com/rooms/664315,06/03/2023,previous scrape,Home in the Heart of the Mission,"Welcome! Our centrally located home is perfect for couples and families. Walking distance to close to 100 restaurants, shops, Alamo Cinema Draft House, farmer's market, bars, live music, parks, public transportation and a block and a half from BARTâ€¦ Sunny, warmest neighborhood in SF, culturally diverse, bursting with life. High Speed Internet, HD TV, Direct TV, HBO/Showtime, Effective 10/1/14, all Airbnb hosts in SF must charge an additional 14% hotel tax on top of room + cleaning per night.<br /><br /><b>The space</b><br />NEW! We now have Fiber Optic Internet service (1 Gig down, 700 Mbps Up) NEW! Our newly split level landscaped backyard features a beautiful slate patio, BBQ grill, potted flowers and succulents, mature olive, avocado, apple and pomegranate trees and realistic, artificial turf (SF is really not friendly to grass lawns). ALSO NEW: Nespresso Machine with 18 flavors/types of cappuccino, espresso and lattes for you to enjoy (in the right glassware).  After a year of host","The melting pot of cultures, the murals, the restaurants, shops, farmer's market, walkability, festivals, bars, access to BART and MUNI.",https://a0.muscache.com/pictures/18027058/fc2b9e6d_original.jpg,https://www.airbnb.com/users/show/3355966,Geoff,24/08/2012,"San Francisco, CA","My wife and I have traveled the world, but have called San Francisco home for 25 years. We invite you to stay with us in our 1896 Edwardian home in the middle of the Mission District, San Francisco's oldest and arguably most vibrant neighborhood filled with a diverse range of some of the City's best restaurants, bars, parks, shops, and more. Not to mention our neighborhood is the warmest, flattest, and fog free part of San Francisco. 

We're 15 minutes from SFO by taxi, a block and a half from the 24th Bart Station and close to many bus and MUNI (subway) lines. Having visited Southeast Asia, Oceania, Australia, Europe, Central America, and of course all over North America, one theme holds true for all our adventures: discover the true culture and flavor wherever we are. 

As your host, we'll do everything we can to make sure you get off the beaten path. We're happy to share our favorite restaurants, local hangouts, and ensure you see the true San Francisco, not just the typical touristy sites. We're into everything from scuba diving, biking, kayaking, hiking, wine, art, music, food, festivals, museums, all things teens, parks, and more. Whatever you're into, we'll point you in the right direction so you have an authentic and memorable time in San Francisco. My motto is from the great Mahatma Ghandi: ""Be the change you wish to see in the world."" Our style of hosting reflects the needs of our guests. When possible, we like to meet our guests. However we understand that many of them are busy on a tight schedule or not interested to meet us so we respect that. We want to make sure every guest is comfortable and part of that is respecting boundaries and their personal space. 

We look forward to hosting you soon! If you have any questions, please feel free to ask. We're just a click away. ",within an hour,100%,100%,t,https://a0.muscache.com/im/pictures/user/69181576-5598-42ee-bdc5-d995b256b3c9.jpg?aki_policy=profile_small,https://a0.muscache.com/im/pictures/user/69181576-5598-42ee-bdc5-d995b256b3c9.jpg?aki_policy=profile_x_medium,Mission District,"['email', 'phone', 'work_email']",t,t,"San Francisco, California, United States",Mission,Entire home,Entire home/apt,2.0,"[""Security cameras on property"", ""Self check-in"", ""Shampoo"", ""Air conditioning"", ""Paid parking off premises"", ""Smoke alarm"", ""Kitchen"", ""Carbon monoxide alarm"", ""Dishes and silverware"", ""Hangers"", ""Dedicated workspace"", ""TV with standard cable"", ""Washer"", ""Hot water"", ""Refrigerator"", ""Backyard"", ""Private patio or balcony"", ""Wifi"", ""Heating"", ""BBQ grill"", ""Iron"", ""Fire pit"", ""Outdoor dining area"", ""First aid kit"", ""Essentials"", ""Hammock"", ""Coffee maker"", ""Outdoor furniture"", ""Hair dryer"", ""Fire extinguisher"", ""Dryer"", ""Lockbox""]",$136.00,t,06/03/2023,18/08/2013,03/01/2019,City Registration Pending,f,664315,20200000000000.0,3355966.0,2.0,2.0,37.75502,-122.41889,6.0,3.0,2.0,7.0,30.0,7.0,7.0,30.0,30.0,7.0,30.0,0.0,0.0,0.0,0.0,6.0,0.0,0.0,4.83,4.9,4.33,5.0,5.0,4.83,5.0,2.0,1.0,1.0,0.0,0.05
126,https://www.airbnb.com/rooms/666620,06/03/2023,city scrape,Modern home in sunny Noe Valley,"Newly remodeled, light filled, two story apartment with open floor plan and a large backyard. Extremely close to public transport in one of the best neighborhoods in SF!<br /><br /><b>The space</b><br />Newly remodeled home in quite family neighborhood of Noe Valley. Close to J-church and BART for public transport. One block from shops, cafes, and restaurants on 24th.  Downstairs media room, bar, master bath and bedroom. Upstairs second bedroom, bath, and kitchen leading to large backyard deck and BBQ for family fun. Modern appliances and amenities throughout.<br /><br /><b>Guest access</b><br />You'll have access to everything in the home - all the modern amenities and appliances; wash/dryer, coffee machine, ice maker, tea kettle, you get the drift...<br /><br /><b>License number</b><br />STR-0000059",Noe Valley is the quintessential San Francisco neighborhood. Lots of Edwardian homes nestled around small shops and cafe's on 24th street.,https://a0.muscache.com/pictures/59246897/9bd15fcf_original.jpg,https://www.airbnb.com/users/show/1841167,Buck,02/03/2012,"San Francisco, CA","Raised in California, work pretty hard but try to balance by seeing as much of the world as often as I can...  A beach, a board, a book, and I'm 100%.",within a day,75%,0%,f,https://a0.muscache.com/im/pictures/user/90080235-8899-436a-8080-7bb59b98bb0f.jpg?aki_policy=profile_small,https://a0.muscache.com/im/pictures/user/90080235-8899-436a-8080-7bb59b98bb0f.jpg?aki_policy=profile_x_medium,Noe Valley,"['email', 'phone', 'work_email']",t,t,"San Francisco, California, United States",Noe Valley,Entire rental unit,Entire home/apt,2.5,"[""Oven"", ""Cooking basics"", ""Luggage dropoff allowed"", ""Shampoo"", ""Smoke alarm"", ""Kitchen"", ""Carbon monoxide alarm"", ""Dishes and silverware"", ""Hangers"", ""Bathtub"", ""TV with standard cable"", ""Washer"", ""Hot water"", ""Refrigerator"", ""Wifi"", ""Heating"", ""Long term stays allowed"", ""Dishwasher"", ""Stove"", ""Essentials"", ""Free street parking"", ""Coffee maker"", ""Hair dryer"", ""Fire extinguisher"", ""Dryer""]",$534.00,t,06/03/2023,28/11/2014,18/07/2021,STR-0000059,f,666620,20200000000000.0,1841167.0,1.0,3.0,37.75162,-122.4307,4.0,2.0,2.0,3.0,144.9,3.0,3.0,1125.0,1125.0,3.0,1125.0,27.0,27.0,56.0,331.0,55.0,0.0,0.0,4.8,4.81,4.8,4.93,4.95,4.96,4.64,1.0,1.0,0.0,0.0,0.55
