182,https://www.airbnb.com/rooms/455783,06/03/2023,previous scrape,Queen Size Bed in Private Room with Loft at Beach,"Comfortable Furnished Bedroom in 3 br apartment.  Across street from Ocean Beach and 5 blocks to Golden Gate Park. Our beautiful neighborhood gives you easy access to both nature and city.<br /><br />Fully equipped modern kitchen, granite counter tops, stainless steel appliances, hardwood floors, washer and dryer, dishwasher, 200 mbs internet.<br /><br />Near mass transit. Free 24 hour street parking in neighborhood. <br /><br />Utilities included.<br /><br />We've opened up just the dates for January, but are also open to long term.<br /><br /><b>The space</b><br />Beautiful, completely renovated (i.e. modern and comfortable) three bedroom flat is located one block from the beach, in the heart of Ocean Beach. Very fast internet connection (200 mbps). This is a safe and quiet neighborhood located along the western edge of San Francisco, where the City meets the Sea.<br /><br />100 square foot Bedroom with closet is clean, well lit, and comfortable with private access through our rear w","This neighborhood is San Francisco's best kept secret. Quiet, but within a quick commute to all of the hustle and bustle of downtown, Ocean Beach revolves around two main places -- 5 miles of beach fronting the Pacific ocean and Golden Gate Park, one of the best urban parks in the country.",https://a0.muscache.com/pictures/17d34e81-80dd-46aa-b679-abfd825c9388.jpg,https://www.airbnb.com/users/show/1421509,Matthew,18/11/2011,"San Francisco, CA","I am a political theorist, a privacy advocate, a big wave surfer and an innovation coach.  You can learn more about both my work and my play by looking for my blog online.  Airbnb doesn't allow you to list websites but you can search for it: my name is Matthew Schutte. And my blog is: ""Matthew Schutte  |  on the future of the internet and society, with a dash of surfing and play""",sin registro,sin registro,sin registro,f,https://a0.muscache.com/im/pictures/user/3bd4cf1b-8a7a-4473-aeae-ad9d7f4722f8.jpg?aki_policy=profile_small,https://a0.muscache.com/im/pictures/user/3bd4cf1b-8a7a-4473-aeae-ad9d7f4722f8.jpg?aki_policy=profile_x_medium,Sunset District,"['email', 'phone']",t,t,"San Francisco, California, United States",Outer Sunset,Private room in rental unit,Private room,1.5,"[""Essentials"", ""Iron"", ""Shampoo"", ""Washer"", ""Hot water"", ""Hair dryer"", ""Dryer"", ""Patio or balcony"", ""Wifi"", ""Heating"", ""Kitchen""]",$44.00,t,06/03/2023,12/06/2015,08/02/2021,sin registro,f,455783,20200000000000.0,1421509.0,2.0,3.3,37.7541,-122.4,1.0,1.0,1.0,30.0,185.0,30.0,30.0,185.0,185.0,30.0,185.0,0.0,0.0,0.0,0.0,99.0,0.0,0.0,4.47,4.62,4.53,4.82,4.82,4.66,4.44,2.0,1.0,2.0,0.0,1.05
183,https://www.airbnb.com/rooms/776239,06/03/2023,city scrape,Modern view 3+bed house above the Castro,"Fully detached house with downtown view in the Castro/Upper Market area, right near the geographic center of San Francisco<br /><br /><b>The space</b><br />NOTE: the house next door is finishing up a remodel, so there may be noise during the day. The price you see has already been lowered by $200 per night to compensate.<br /><br />Our renovated, loft-like single family home is right in the middle of San Francisco on a low-traffic street but close to everything. Our cat won't be there, but some of his dander might be for those who are especially allergic.<br /><br />About 1800 sqft, our house features views of downtown San Francisco. Bedroom 1 is the massive master suite upstairs (which is open to the living area below) containing a king size bed + super comfy Ligne Roset queen sofa bed. Bedroom 2 has a queen bed, and bedroom 3 has a queen and is in an open area down a flight of stairs - no door. Plus there's another room we're calling ""the cave"" (you could call it bedroom 4) that you ","We're right by the colorful Castro district, with plentiful coffee houses, restaurants, shopping and nightlife. It's a seven minute walk to a nearby supermarket that offers free shuttle service back to the house for you and your groceries.",https://a0.muscache.com/pictures/2b83751e-6e15-4df5-b2ec-4826d070c732.jpg,https://www.airbnb.com/users/show/4094089,Josh,08/11/2012,"San Francisco, CA",I'm Josh and my husband's name is Britton. I'm a freelance graphic designer and he's a consultant. He speaks fluent Japanese and Spanish as well as some Thai. ,within a few hours,100%,84%,t,https://a0.muscache.com/im/users/4094089/profile_pic/1352394160/original.jpg?aki_policy=profile_small,https://a0.muscache.com/im/users/4094089/profile_pic/1352394160/original.jpg?aki_policy=profile_x_medium,The Castro,"['email', 'phone', 'work_email']",t,t,"San Francisco, California, United States",Castro/Upper Market,Entire home,Entire home/apt,2.0,"[""Oven"", ""Security cameras on property"", ""Clothing storage: wardrobe, closet, walk-in closet, and dresser"", ""Self check-in"", ""Cooking basics"", ""Luggage dropoff allowed"", ""Blender"", ""Sound system with Bluetooth and aux"", ""Shampoo"", ""Dining table"", ""Free dryer \u2013 In unit"", ""Smoke alarm"", ""Baking sheet"", ""Room-darkening shades"", ""Coffee"", ""Free washer \u2013 In unit"", ""Garden view"", ""Bed linens"", ""Carbon monoxide alarm"", ""Kitchen"", ""Dishes and silverware"", ""Extra pillows and blankets"", ""Hangers"", ""Bathtub"", ""58\"" HDTV with Amazon Prime Video, Apple TV, HBO Max, Netflix, premium cable, standard cable"", ""Body soap"", ""Free residential garage on premises \u2013 1 space"", ""Dedicated workspace"", ""Microwave"", ""Hot water"", ""Refrigerator"", ""Private patio or balcony"", ""Bidet"", ""Wifi"", ""Ethernet connection"", ""Central heating"", ""Freezer"", ""Shower gel"", ""Dishwasher"", ""Iron"", ""Private backyard \u2013 Not fully fenced"", ""Outdoor dining area"", ""Hot water kettle"", ""First aid kit"", ""Stove"", ""City skyline view"", ""Books and reading material"", ""Ceiling fan"", ""Toaster"", ""Portable fans"", ""Essentials"", ""Rice maker"", ""Coffee maker"", ""Free street parking"", ""Wine glasses"", ""Outdoor furniture"", ""Cleaning products"", ""Conditioner"", ""Hair dryer"", ""Private entrance"", ""Fire extinguisher"", ""Lockbox""]",$338.00,t,06/03/2023,29/07/2016,14/10/2022,STR-0002738,f,776239,20200000000000.0,4094089.0,1.0,2.0,37.75948,-122.44357,6.0,3.0,1.6,5.0,144.9,5.0,5.0,1125.0,1125.0,5.0,1125.0,0.0,5.0,35.0,154.0,46.0,11.0,0.0,4.98,4.98,4.91,5.0,4.98,4.89,4.83,1.0,1.0,0.0,0.0,0.57
185,https://www.airbnb.com/rooms/779575,06/03/2023,city scrape,Room downtown one person,"I am subletting my room, only reservations for at least 60 days are considered.  Room for 1 person,  only one guest (you) since the lease will include you and me, no overnight visitors, management monitors access. Shower bathroom on hallway<br /><br /><b>The space</b><br />Single room in Down Town San Francisco.<br />Old style residential hotel, near everything.<br /><br />At least 2+ months reservation Only.<br /><br />Conveniently located, close to everything in the city. <br />Stays from 3 months only.<br /><br />Room with a sink and some cooking things. Bath and restroom on hall way, never crowded.<br /><br />I am subletting and you would be included in lease as a second and only other guest. They enforce entrance of tenants after 9 pm<br />so this reservation is for 1 more person Only, <br /><br /><br />Location: near,<br />CIVIC CENTER, UNION SQUARE, SOMA, CASTRO, EMBARCADERO, MISSION.<br />1/2 a block from Bart (subway), <br />5 min. walk to Union Square, <br />15 min walk to Ca","Downtown.... right between the run down area and the new mid-market and SOMA, very safe around here but you definitely will see homeless people",https://a0.muscache.com/pictures/301b9067-235b-4158-9968-71bc3e222ef9.jpg,https://www.airbnb.com/users/show/4110614,Francisco,10/11/2012,"Los Angeles, CA","I am a long-time language instructor. and translator. So, I am knowledgeable and love to share the Latino language and Cultures. It also helps that I like walking around the city, 

Other personal likes: a nice cup a tea mainly outdoors, etc.  I have practiced Yoga for over 30 years and Tai-chi, too

I am well aware of current events and news -real news-

Ok, nos vemos amigous",sin registro,sin registro,sin registro,f,https://a0.muscache.com/im/pictures/user/c00247a5-c106-4eb8-989f-077ff8ccb63a.jpg?aki_policy=profile_small,https://a0.muscache.com/im/pictures/user/c00247a5-c106-4eb8-989f-077ff8ccb63a.jpg?aki_policy=profile_x_medium,Civic Center,"['email', 'phone', 'work_email']",t,t,"San Francisco, California, United States",South of Market,Private room in hostel,Private room,3.0,"[""Dryer"", ""Washer"", ""Heating""]",$120.00,t,06/03/2023,18/11/2012,26/08/2015,sin registro,f,779575,20200000000000.0,4110614.0,1.0,4.0,37.77685,-122.41701,1.0,1.0,2.0,30.0,120.0,30.0,30.0,120.0,120.0,30.0,120.0,30.0,60.0,90.0,365.0,7.0,0.0,0.0,4.8,4.9,4.8,4.9,4.9,4.8,4.7,1.0,1.0,1.0,0.0,0.06
186,https://www.airbnb.com/rooms/781945,06/03/2023,previous scrape,Huge Condo in the best Location,"<b>The space</b><br />Sorry, this place cannot be rented just for few days because of the strict CC&R rules enforced by the HOA.  <br /> <br />Whether you are actively working in this area or simply looking to stay here to enjoy the city life, there is perhaps no better location than this one to live and enjoy San Francisco. This is going to be rented very soon. If you are relocating to the city from somewhere else this is perhaps as good as a hassle free arrangement you can get.  <br /> <br />Ignore the pictures for now, the Condo is getting a solid make over with brand new all white appliances and a clear bamboo floor.  <br /> <br />Unlike most 2-3 bedroom Condos  in the City, this Condo is huge and has a huge great Patio, perhaps the largest one from where you can sit and relax. <br /> <br />If you consider renting for a 12 month period instead of six months I'll consider adding one or two furniture to make your living very comfortable.   <br /> <br />This 2 bedroom, 2 bath  condo i",sin registro,https://a0.muscache.com/pictures/13638519/1246a32b_original.jpg,https://www.airbnb.com/users/show/4124339,Tanmay,11/11/2012,"San Francisco, CA","I have lived and worked in San Francisco for most of my career and in the SOMA neighborhood for last 8 years. It is perhaps the most incredible place to live and work. I love traveling and hiking around here in the Bay area among other stuff that I do. Work and travel keep me busy.  

Professionally, I'm the founder and CEO of (Website hidden by Airbnb) , an early stage start up focused on international travel. I am an experienced entrepreneur and internet executive with special focus and emphasis on international travel. Proven track record of building and scaling profitable companies and lines of businesses. Most recently played a key role in taking Travix BV ( (Website hidden by Airbnb) an airline ticketing company from launch to multibillion dollar 20+ country success with 6+ brands in just short 5 years while generating serious profit. Focused on data driven innovation to make travel search and service simple, relevant and cost efficient.

When I'm in town I'd love to get to know someone who may be visiting from out of country or for business. Most people who I have stayed here so far are tend to be professionals. I love learning and sharing about people, places, cultures and ideas. I'm passionate about consumer centric businesses, things and ideas that can help people in general in some form or the other. Academically I have crossed many disciplines from engineering to environmental science, energy management to finance and investment and worked in a few fields including venture capital and investment banking. I'm still learning not much through reading but more so through execution and conversation. 

Live more has been my way of living while having a less cluttered and more organized simple life style. If you ever happen to be my guest, you may enjoy a conversation over dinner or drinks. 

Happy travelling !",sin registro,sin registro,sin registro,f,https://a0.muscache.com/im/users/4124339/profile_pic/1360363318/original.jpg?aki_policy=profile_small,https://a0.muscache.com/im/users/4124339/profile_pic/1360363318/original.jpg?aki_policy=profile_x_medium,SoMa,"['email', 'phone']",t,t,sin registro,Financial District,Entire rental unit,Entire home/apt,2.0,"[""Elevator"", ""Smoking allowed"", ""TV with standard cable"", ""Washer"", ""Pool"", ""Pets allowed"", ""Dryer"", ""Wifi"", ""Heating"", ""Kitchen""]",$350.00,f,06/03/2023,22/06/2013,13/09/2013,sin registro,f,781945,20200000000000.0,4124339.0,1.0,2.0,37.78471,-122.39852,4.0,2.0,2.0,16.9,144.9,16.8,17.2,1195.0,1195.0,17.0,1195.0,0.0,0.0,0.0,0.0,3.0,0.0,0.0,4.8,4.9,4.8,4.9,5.0,5.0,4.7,1.0,1.0,0.0,0.0,0.03
188,https://www.airbnb.com/rooms/784071,06/03/2023,city scrape,Elegant Spacious Flat with PARKING,"Beautiful, fully furnished two bedroom flat located in one of San Francisco's most popular neighborhoods. The building is a turn of the century, fully restored Victorian. The flat is huge, clean and contemporary with many modern amenities. It is approximately 1500 square feet and is totally private, including its own private entrance. Available for minimum of 30 night stays.<br /><br /><b>The space</b><br />Secure, locked, GARAGE PARKING for one AVERAGE SIZE car is included in the price.<br /><br />The full kitchen has a new dishwasher, oven, toaster, microwave, refrigerator and a private laundry area.  There's one full bathroom with tub and shower and a second half bathroom.  There's also plenty of heat and endless hot water.  <br /><br />The space can easily accommodate up to four people with two incredibly comfortable queen size beds.  Both bedrooms have large closets that make it easy to store suit cases and hang clothes.  <br /><br />There is a 42"" flat screen, hi-def television f","The neighborhood is vibrant and cosmopolitan, perfectly situated between the Castro, Noe Valley and the Mission.  With Dolores Park half a block away there are lots of activities and iconic views at your fingertips.",https://a0.muscache.com/pictures/miso/Hosting-784071/original/a4aaf95b-dcc1-4399-9501-377dee29053e.jpeg,https://www.airbnb.com/users/show/3772252,Timothy,05/10/2012,"San Francisco, CA","I love movies, shows food and friends.",within an hour,100%,100%,t,https://a0.muscache.com/im/users/3772252/profile_pic/1378598887/original.jpg?aki_policy=profile_small,https://a0.muscache.com/im/users/3772252/profile_pic/1378598887/original.jpg?aki_policy=profile_x_medium,The Castro,"['email', 'phone']",t,t,"San Francisco, California, United States",Castro/Upper Market,Entire rental unit,Entire home/apt,1.5,"[""Oven"", ""Security cameras on property"", ""Self check-in"", ""Cooking basics"", ""Pert shampoo"", ""Luggage dropoff allowed"", ""Dining table"", ""Free dryer \u2013 In unit"", ""Smoke alarm"", ""Baking sheet"", ""Room-darkening shades"", ""Free washer \u2013 In unit"", ""50\"" HDTV with Roku, Netflix, HBO Max, Amazon Prime Video"", ""Bed linens"", ""Carbon monoxide alarm"", ""Kitchen"", ""Dishes and silverware"", ""Extra pillows and blankets"", ""Hangers"", ""Bathtub"", ""Dedicated workspace"", ""Microwave"", ""Laundromat nearby"", ""Hot water"", ""Refrigerator"", ""Private patio or balcony"", ""Wifi"", ""Gas stove"", ""Keypad"", ""Suave body soap"", ""Central heating"", ""Long term stays allowed"", ""Freezer"", ""Shower gel"", ""Dishwasher"", ""Suave conditioner"", ""Iron"", ""Clothing storage: dresser and closet"", ""Hot water kettle"", ""First aid kit"", ""Toaster"", ""Portable fans"", ""Essentials"", ""Free street parking"", ""Coffee maker"", ""Wine glasses"", ""Outdoor furniture"", ""Free parking garage on premises \u2013 1 space"", ""Hair dryer"", ""Private entrance"", ""Fire extinguisher""]",$300.00,t,06/03/2023,18/11/2012,10/12/2022,sin registro,f,784071,20200000000000.0,3772252.0,2.0,11.0,37.7601,-122.42869,4.0,2.0,2.0,30.0,144.9,30.0,30.0,1125.0,1125.0,30.0,1125.0,26.0,56.0,86.0,361.0,98.0,4.0,0.0,4.9,4.87,4.91,4.98,4.95,4.93,4.83,1.0,1.0,0.0,0.0,0.78
191,https://www.airbnb.com/rooms/468490,06/03/2023,city scrape,Penthouse Panoramic View Home with Decks,"A perfect Penthouse Home with all the views and amenities. <br />Just lovely. Super clean. Welcome.<br /><br /><b>The space</b><br />Exclusive Entire Penthouse top floor contemporary condo. 2,200 square feet. Views of downtown and sweeping bay views with Alcatraz in the center. 3 carpeted bedrooms plus additional room/office bedroom. King bed, full bed, twin bed, and portable queen and twin beds available. Two and half baths with double sinks, glass shower, tub and Jacuzzi but the jacuzzi leaks and can not be used. Three fireplaces. Huge gourmet kitchen. Sudden hardwood living room. Big screen TV's, WIFI, and washer/dryer/cleaning supplies for small fee. Three large outside decks. Completely remodeled  with cathedral ceilings, hardwood, views of the bay, Alcatraz and city. Fireplaces in master suite, living room and kitchen area. Dining room complete with table that seats up to 10 people. Everything is sparkling clean.<br /><br />Paid parking available near by in the fisherman wharf ar",Perfect location in walking distance from almost anything.,https://a0.muscache.com/pictures/9903002/8eda9fed_original.jpg,https://www.airbnb.com/users/show/285168,Bill,12/11/2010,"San Francisco, CA","Easy going, non-smoker, ultra clean and been in San Francisco for twenty + years and traveled around the world for years.  

My location is just great. There is so much, so close to explore and experience. Walk to Russian Hill, Lombard Street, 
Fisherman's Wharf, North Beach, Chinatown, Union Square........come enjoy my home, location and city.       Welcome!",within a few hours,100%,83%,f,https://a0.muscache.com/im/pictures/user/1fe7c47f-bdb7-4112-ab86-ea35b9cd69fb.jpg?aki_policy=profile_small,https://a0.muscache.com/im/pictures/user/1fe7c47f-bdb7-4112-ab86-ea35b9cd69fb.jpg?aki_policy=profile_x_medium,Russian Hill,"['email', 'phone']",t,t,"San Francisco, California, United States",Russian Hill,Entire condo,Entire home/apt,2.5,"[""Oven"", ""Security cameras on property"", ""Self check-in"", ""Cooking basics"", ""Blender"", ""Shampoo"", ""Dining table"", ""Paid parking off premises"", ""Smoke alarm"", ""Paid dryer \u2013 In unit"", ""Baking sheet"", ""Room-darkening shades"", ""Coffee"", ""Kitchen"", ""Bed linens"", ""Carbon monoxide alarm"", ""Dishes and silverware"", ""Extra pillows and blankets"", ""Hangers"", ""Fireplace guards"", ""Harbor view"", ""Paid washer \u2013 In unit"", ""Clothing storage: closet"", ""Dedicated workspace"", ""Microwave"", ""Laundromat nearby"", ""Hot water"", ""Refrigerator"", ""Backyard"", ""Private patio or balcony"", ""Wifi"", ""Heating"", ""Board games"", ""Keypad"", ""Ethernet connection"", ""Freezer"", ""Dishwasher"", ""Iron"", ""Hot water kettle"", ""Crib - always at the listing"", ""Stove"", ""Trash compactor"", ""City skyline view"", ""Toaster"", ""Essentials"", ""Free street parking"", ""Coffee maker"", ""Wine glasses"", ""Pack \u2019n play/Travel crib"", ""Bay view"", ""Elevator"", ""Cleaning products"", ""Conditioner"", ""Hair dryer"", ""Private entrance"", ""Fire extinguisher"", ""70\"" HDTV with Netflix"", ""Single level home""]",$399.00,t,06/03/2023,22/11/2013,03/02/2023,STR-0000265,f,468490,20200000000000.0,285168.0,1.0,5.0,37.80109,-122.41385,3.0,1.5,1.6,2.0,180.0,2.0,2.0,180.0,180.0,2.0,180.0,7.0,21.0,36.0,271.0,65.0,19.0,0.0,4.58,4.9,4.86,4.84,4.7,4.86,4.7,1.0,1.0,0.0,0.0,0.57
194,https://www.airbnb.com/rooms/60365,06/03/2023,city scrape,Charming Victorian 3-Bedrms-2Baths + Free Parking!,"1890 renovated Victorian,  an authentic San Francisco experience. Centrally located 3 bdms,  2 ba, fully equipped kitchen, laundry, cozy backyard w dining & new BBQ grill. Gorgeous views of downtown from front terrace. Walk to Haight-Ashbury, Golden Gate Park, the Castro, Alamo Square (Painted Ladies), Hayes Valley.  Walk to grocery, cafes & restaurants. Great urban hiking from house. Buses and subway within 2 blocks.  Free parking at the house, see full description for details.<br /><br /><b>The space</b><br />Enhanced cleaning protocol, see details below.  Pet free and smoke free household.  Authentic and renovated 1890 Victorian (one of those tourists come here to gaze at), in a central location yet on a safe, quiet and charming tree-lined street, with attractions, food, shopping and public transportation within walking distance. Top rated location in town. While our street is quiet, it's one block from Haight St & 1/2 block to Divisadero St. Lots of fun shopping, cafes, grocery sto","The neighborhood is simply beautiful, with restored late 1800/early 1900's Victorians all around.  Buena Vista Park is just a couple of blocks up the hill surrounded by amazing archictectural gems and breathtaking views of the city and the bay.  Duboce Park a block away is also surrounded by such quaint beautiful houses that they are on the tour bus route (those buses avoid our block because of our short  hill, keeping this section of our street a quiet secret!)  Yet with Haight St and Divisadero just a block away, public transportation, grocery stores, cafes and restaurants abound within a short walk.",https://a0.muscache.com/pictures/miso/Hosting-60365/original/864468d9-4e0e-4bd0-a04d-8fe069417f22.jpeg,https://www.airbnb.com/users/show/279544,Emilie,06/11/2010,"San Francisco, CA","I came to San Francisco for the first time many years ago to visit my daughter.  I couldn't visit for long, sleeping in her and her roommate's living room. Time together was precious, hotels were too far and too expensive.  My dream of owning a house close to daughter and grandchildren came true.
  I am now  living the dream of hosting fellow visiting parents and grandparents, in addition to vacationers, business travelers,  individuals and families the world over.  I really enjoy sharing my house and my city.
My husband and I love family, friends, music, nature, great food and wine, old movies, sports.  We are hikers, birders and world travelers.  We appreciate cultural diversity and individual uniqueness.
My motto:  Dream it, love it, expect it, and you will experience it!",within an hour,100%,97%,t,https://a0.muscache.com/im/users/279544/profile_pic/1297395365/original.jpg?aki_policy=profile_small,https://a0.muscache.com/im/users/279544/profile_pic/1297395365/original.jpg?aki_policy=profile_x_medium,Duboce Triangle,"['email', 'phone']",t,t,"San Francisco, California, United States",Western Addition,Entire home,Entire home/apt,2.0,"[""Oven"", ""Self check-in"", ""Cooking basics"", ""Luggage dropoff allowed"", ""Lockbox"", ""Blender"", ""Shampoo"", ""Dining table"", ""Free parking on premises"", ""Smoke alarm"", ""Baking sheet"", ""Coffee"", ""Drying rack for clothing"", ""Barbecue utensils"", ""Kitchen"", ""Bed linens"", ""High chair"", ""Carbon monoxide alarm"", ""Dishes and silverware"", ""Extra pillows and blankets"", ""Hangers"", ""Bathtub"", ""Dedicated workspace"", ""Microwave"", ""Washer"", ""Hot water"", ""Refrigerator"", ""Backyard"", ""Private patio or balcony"", ""Wifi"", ""Gas stove"", ""BBQ grill"", ""Changing table"", ""Shower gel"", ""Children\u2019s books and toys"", ""Iron"", ""Freezer"", ""Dishwasher"", ""Radiant heating"", ""Outdoor dining area"", ""Hot water kettle"", ""Children\u2019s dinnerware"", ""Toaster"", ""Essentials"", ""Free street parking"", ""Coffee maker"", ""Crib"", ""Pack \u2019n play/Travel crib"", ""Wine glasses"", ""Outdoor furniture"", ""Hair dryer"", ""Private entrance"", ""Fire extinguisher"", ""Dryer"", ""55\"" HDTV with Amazon Prime Video, Disney+, HBO Max, premium cable, DVD player""]",$546.00,t,06/03/2023,24/12/2010,13/02/2023,STR-0003775,f,60365,20200000000000.0,279544.0,6.0,10.0,37.77034,-122.43594,6.0,3.0,1.6,4.0,30.0,4.0,4.0,1125.0,1125.0,4.0,1125.0,3.0,10.0,40.0,197.0,248.0,16.0,1.0,4.87,4.86,4.92,4.92,4.91,4.86,4.78,2.0,1.0,0.0,0.0,1.67
