,listing_url,last_scraped,source,name,description,neighborhood_overview,picture_url,host_url,host_name,host_since,host_location,host_about,host_response_time,host_response_rate,host_acceptance_rate,host_is_superhost,host_thumbnail_url,host_picture_url,host_neighbourhood,host_verifications,host_has_profile_pic,host_identity_verified,neighbourhood,neighbourhood_cleansed,property_type,room_type,bathrooms_text,amenities,price,has_availability,calendar_last_scraped,first_review,last_review,license,instant_bookable,id,scrape_id,host_id,host_listings_count,host_total_listings_count,latitude,longitude,accommodates,bedrooms,beds,minimum_nights,maximum_nights,minimum_minimum_nights,maximum_minimum_nights,minimum_maximum_nights,maximum_maximum_nights,minimum_nights_avg_ntm,maximum_nights_avg_ntm,availability_30,availability_60,availability_90,availability_365,number_of_reviews,number_of_reviews_ltm,number_of_reviews_l30d,review_scores_rating,review_scores_accuracy,review_scores_cleanliness,review_scores_checkin,review_scores_communication,review_scores_location,review_scores_value,calculated_host_listings_count,calculated_host_listings_count_entire_homes,calculated_host_listings_count_private_rooms,calculated_host_listings_count_shared_rooms,reviews_per_month
2,https://www.airbnb.com/rooms/8142,06/03/2023,city scrape,Friendly Room Apt. Style -UCSF/USF - San Francisco,"Nice and good public transportation.  7 minutes walk to UCSF.  15 minutes walk to USF, ST Mary Hospital <br /><br />Room rental-sunny view room/sink/Wi Fi (inner sunset / UCSF) (map)<br /><br />The place is located within walking distance to Golden Gate Park, UCSF &  USF<br /><br /><b>The space</b><br />Settle down, S.F. resident, student, hospital, job relocated, rotation. <br /><br />Monthly rental, short term staying - Nice public transportation location. <br /><br />No tourist or transient.  No pet no smoking no party inside the building.<br /><br />Medium private lock room(130 square feet) single person.<br /> <br />Large private lock room(190 square feet) single person.<br /><br />Extra large private room(230 square feet)  single person.<br /><br />Additional bed $20 per night.<br /><br />Surround by sunny view and good transportation. <br /><br />Room with sink(apartment style - shared large eat in kitchen/2 full & 2 half  bathrooms). Quiet house under management. <br /><br />Wa","N Juda Muni, Bus and UCSF Shuttle.<br /><br />UCSF campus and hospital, Shopping old town, restaurants, Golden Gate Park, <br /><br />Museums, Walgreen store, Haight street, Whole food, Safeway & Target stores.",https://a0.muscache.com/pictures/12d8bff0-1698-4e51-aeba-47b4068cf529.jpg,https://www.airbnb.com/users/show/21994,Aaron,17/06/2009,"San Francisco, CA","7 minutes walk to UCSF hospital & school campus.  15 minutes walk to USF, St. Mary Hospital.  5 minute walk to Golden Gate Park/Whole food/ regular food store and many different style restaurants & stores in stylish town.

Two ways public muni transportation in front the building to sunset areas/downtown/Golden Gate Bridge/Cal Train station/Airport.  Other 5 minutes walking distance bus stops to downtown and different areas.

Medium side room with one bed only . Extra large size of room with  one single or one full size bed only. The price just a little bit different but have more space. 

Please email your job offer letter and current official picture ID / acceptable credit report and score and financial information after you make reservation.  

Additional adult person  will be charged per night & One time standard cleaning fee $50  and  security deposit will be collected upon your arrival.   

Wi-Fi signal in common areas.   Large eat in kitchen.  Sunny sitting room.

Not pet/Not for any kinds of smoking/no party.  Quiet hours 8pm-9am

Simple cooking only, We have  cooktop and mini toaster oven with timer.   Refrigerator shared storage is limited and Whole Food supermarket in 7 minutes' walking distance.  Coin operated washer and dryer machine in the building.  No pet, No party, No smoking, not for any kinds of smoking, no candle, no tourist, no transient. 



",within an hour,100%,73%,f,https://a0.muscache.com/im/users/21994/profile_pic/1428380894/original.jpg?aki_policy=profile_small,https://a0.muscache.com/im/users/21994/profile_pic/1428380894/original.jpg?aki_policy=profile_x_medium,Cole Valley,"['email', 'phone']",t,t,"San Francisco, California, United States",Haight Ashbury,Private room in rental unit,Private room,4.0,"[""Security cameras on property"", ""Host greets you"", ""Dining table"", ""Smoke alarm"", ""Lock on bedroom door"", ""Paid dryer \u2013 In building"", ""Kitchen"", ""Carbon monoxide alarm"", ""Dishes and silverware"", ""Hangers"", ""Dedicated workspace"", ""Laundromat nearby"", ""Hot water"", ""Refrigerator"", ""Wifi"", ""Heating"", ""Long term stays allowed"", ""Free street parking"", ""Paid washer \u2013 In building"", ""Private entrance"", ""Fire extinguisher""]",$56.00,t,06/03/2023,08/09/2014,27/10/2022,sin registro,f,8142,20200000000000.0,21994.0,1.9,3.3,37.76555,-122.45213,1.0,1.0,1.0,32.0,90.0,32.0,32.0,90.0,90.0,32.0,90.0,30.0,60.0,90.0,365.0,9.0,1.0,0.0,4.67,4.9,4.44,4.78,4.78,4.67,4.67,1.4,1.0,0.4,0.0,0.09
3,https://www.airbnb.com/rooms/8339,06/03/2023,city scrape,Historic Alamo Square Victorian,"Pls email before booking. <br />Interior featured in magazines. Listed historic with the City of SF. Steps away from the iconic Alamo Square ""Painted Ladies"".<br /><br /><b>The space</b><br />Please send us a quick message before booking :) <br /><br />Victorian flat in Queen Ann Victorian. <br /><br />Interior featured in magazines. Listed historic with the City of San Francisco. Steps away from the iconic Alamo Square ""Painted Ladies"" postcard panorama. <br /><br /><br />Tour buses pause.<br /> This spacious sunny apartment is well known by local photographers for its ambiance and beautiful natural light. (Rental does not imply permission for commercial photography use) <br /><br />Centrally located close to public transport, top restaurants, shops, arts and entertainment near NOPA/Alamo square/Haight/Hayes. 2 blocks away from public transpo.<br />Safe walkable neighborhood. <br /><br />Authentic Updated Victorian experience. This Queen Anne Victorian was built by a noted Victorian a",sin registro,https://a0.muscache.com/pictures/miso/Hosting-8339/original/af1167c5-b4c4-4020-a58b-9fa13f2dc2fe.jpeg,https://www.airbnb.com/users/show/24215,Rosy,02/07/2009,"San Francisco, CA","I'm an Interior Stylist living in SF. 


",within a few hours,100%,0%,f,https://a0.muscache.com/im/pictures/user/6e05b298-5b76-443f-a4fb-367d0b4bc9ab.jpg?aki_policy=profile_small,https://a0.muscache.com/im/pictures/user/6e05b298-5b76-443f-a4fb-367d0b4bc9ab.jpg?aki_policy=profile_x_medium,Alamo Square,"['email', 'phone']",t,t,sin registro,Western Addition,Entire condo,Entire home/apt,1.5,"[""Oven"", ""Cooking basics"", ""TV"", ""Smoke alarm"", ""Kitchen"", ""Bed linens"", ""Carbon monoxide alarm"", ""Dishes and silverware"", ""Extra pillows and blankets"", ""Hangers"", ""Bathtub"", ""Body soap"", ""Dedicated workspace"", ""Microwave"", ""Laundromat nearby"", ""Hot water"", ""Refrigerator"", ""Wifi"", ""Heating"", ""Long term stays allowed"", ""Dishwasher"", ""Iron"", ""Hot water kettle"", ""First aid kit"", ""Stove"", ""Books and reading material"", ""Toaster"", ""Essentials"", ""Rice maker"", ""Coffee maker"", ""Free street parking"", ""Wine glasses"", ""Cleaning products"", ""Hair dryer"", ""Fire extinguisher""]",$575.00,t,06/03/2023,25/09/2009,28/06/2019,STR-0000264,f,8339,20200000000000.0,24215.0,2.0,6.0,37.77564,-122.43642,4.0,2.0,2.0,9.0,91.0,9.0,9.0,91.0,91.0,9.0,91.0,30.0,60.0,90.0,365.0,28.0,0.0,0.0,4.87,4.88,5.0,4.94,5.0,4.94,4.75,2.0,1.0,0.0,0.0,0.17
7,https://www.airbnb.com/rooms/10537,06/03/2023,city scrape,Elegant & Cozy w/City views. Private room: Purple,"Casa de Paz (House of Peace) is like staying with family!  If you want to experience San Francisco <br />like a local...instead of feeling like a tourist, this is the place for you.  <br />Here you will wake up in your own peaceful room, with a view of San Fra<br /><br /><b>The space</b><br />Casa de Paz (House of Peace) is like staying with family!  If you want to experience San Francisco <br />like a local...instead of feeling like a tourist, this is the place for you.  <br />Here you will wake up in your own peaceful room, with a view of San Francisco & the smell of fresh coffee brewing downstairs!  <br /><br />You may also enjoy the following amenities: <br />Use of kitchen<br />Internet/cable<br />Laundry Facilities<br />Beautiful Hiking right outside the back   door!  (Also, walking distance from the 49er stadium if you're a football fan!)<br />Less than 1 &1/2 blocks from public transportation (T-line light rail)<br />Minutes away from all main freeways, provides a quick commute",sin registro,https://a0.muscache.com/pictures/miso/Hosting-10537/original/67f51e1b-9bf4-470d-917d-ebf6e6409ff5.jpeg,https://www.airbnb.com/users/show/36752,Teresa,07/09/2009,"San Francisco, CA",From San Francisco,within a few hours,100%,100%,t,https://a0.muscache.com/im/users/36752/profile_pic/1259119407/original.jpg?aki_policy=profile_small,https://a0.muscache.com/im/users/36752/profile_pic/1259119407/original.jpg?aki_policy=profile_x_medium,Bayview,"['email', 'phone', 'work_email']",t,t,sin registro,Bayview,Private room,Private room,1.5,"[""Self check-in"", ""Shared BBQ grill: charcoal"", ""Cooking basics"", ""Luggage dropoff allowed"", ""Blender"", ""Coffee maker: drip coffee maker"", ""Shampoo"", ""Stainless steel gas stove"", ""Dining table"", ""Free dryer \u2013 In unit"", ""Pets allowed"", ""Smoke alarm"", ""Baking sheet"", ""Coffee"", ""Barbecue utensils"", ""Free washer \u2013 In unit"", ""Kitchen"", ""Bed linens"", ""Carbon monoxide alarm"", ""Dishes and silverware"", ""Extra pillows and blankets"", ""Hangers"", ""Body soap"", ""Microwave"", ""Shared gym in building"", ""Hot water"", ""Indoor fireplace: gas"", ""Refrigerator"", ""Shared patio or balcony"", ""Wifi"", ""Keypad"", ""Board games"", ""Central heating"", ""Long term stays allowed"", ""Freezer"", ""Shower gel"", ""Dishwasher"", ""Iron"", ""Stainless steel oven"", ""Hot water kettle"", ""First aid kit"", ""Books and reading material"", ""City skyline view"", ""47\"" HDTV with Amazon Prime Video, Apple TV, Netflix, premium cable"", ""Toaster"", ""Exercise equipment: free weights, treadmill, yoga mat"", ""Essentials"", ""Free street parking"", ""Crib"", ""Pack \u2019n play/Travel crib"", ""Bay view"", ""Wine glasses"", ""Outdoor furniture"", ""Cleaning products"", ""Conditioner"", ""Hair dryer"", ""Fire extinguisher"", ""Waterfront""]",$95.00,t,06/03/2023,21/02/2010,28/01/2023,2022-011003STR,f,10537,20200000000000.0,36752.0,2.0,3.0,37.7175,-122.39698,2.0,1.0,1.0,1.0,90.0,1.0,1.0,90.0,90.0,1.0,90.0,30.0,60.0,90.0,365.0,19.0,1.0,0.0,4.94,4.79,5.0,4.86,5.0,4.8,4.46,2.0,1.0,2.0,0.0,0.12
8,https://www.airbnb.com/rooms/491867,06/03/2023,city scrape,Central San Francisco Urban Dream,"3 BR/2 BA Victorian flat beautifully restored with all the charming details, the comfort of modern amenities plus a beautiful garden to hang out in. One block to public transportation, walking distance to many great restaurants, shops and parks.<br /><br /><b>The space</b><br />3 BR/2 BA Victorian flat beautifully restored with all the charming details, the comfort of modern amenities plus a beautiful garden to hang out in.  We are in the Lower Haight neighborhood (not Hayes Valley).  Muni train 2 blocks away, several buses less than 1 block away.  Walking distance to Haight Ashbury, NOPA, Hayes Valley and Castro restaurants, bars, shops and Golden Gate Park.  We're close to the geographic center of San Francisco so you can get to the best neighborhoods easily from here.  <br />There's loads of space for you and your family or friends.  Come back to a comfortable, homey place after your day exploring the city.  We are both travelers and explorers and have lots of info and maps of the r","Nearby market:  Right out the front door, right at the corner.  At the next corner (Haight and Scott) organic market on the right, regular corner store on the left<br /><br />Big Grocery:  Safeway at Market and Church<br /><br />Cafe/coffee:  For Haight street character: Cafe International  (Haight and Fillmore); For a decent place to go with your laptop: Bean There (Steiner and Waller); For the Frenchie feel:  Le Cafe du Soleil (Fillmore and Waller).  Slightly further but very cute for breakfast/brunch: Cafe Flore (Market and Noe).  If you are a coffee connoisseur - The Mill (Divisadero and Fulton)<br /><br />Drinks:  Famous for its beer on tap: Toronado (Haight between Steiner and Fillmore; get a sausage at Rosamunde next door while you are there); Funky: The Noc Noc (a few doors towards Steiner, next to Toronado); Trendy, fancy cocktails: Maven (Haight and Steiner).  Several good bars at Divisadero between Fell and Fulton too (Madrone, MiniBar, the bar at NOPA, Fly Bar).<br /><br />",https://a0.muscache.com/pictures/miso/Hosting-491867/original/63a7bb4b-0686-4d59-9c55-daa33d77317c.jpeg,https://www.airbnb.com/users/show/969518,Sona,14/08/2011,"San Francisco, CA","I am American of Indian decent and I live here with my husband who is Guatemalan and French and our dog (of unknown decent), Leela.  I've been in the bay area for 12 years so will have lots of travel ideas for you.  We love our home and would love to share it with a few good travelers.",within a few hours,100%,61%,t,https://a0.muscache.com/im/users/969518/profile_pic/1313352624/original.jpg?aki_policy=profile_small,https://a0.muscache.com/im/users/969518/profile_pic/1313352624/original.jpg?aki_policy=profile_x_medium,Lower Haight,"['email', 'phone']",t,t,"San Francisco, California, United States",Western Addition,Entire condo,Entire home/apt,2.0,"[""Oven"", ""Self check-in"", ""Cooking basics"", ""Luggage dropoff allowed"", ""Shampoo"", ""Pets allowed"", ""Smoke alarm"", ""Room-darkening shades"", ""Kitchen"", ""Bed linens"", ""High chair"", ""Dishes and silverware"", ""Extra pillows and blankets"", ""Hangers"", ""Baby monitor"", ""Baby bath"", ""Bathtub"", ""Dedicated workspace"", ""Microwave"", ""Hot water"", ""Refrigerator"", ""Shared patio or balcony"", ""Backyard"", ""Wifi"", ""Heating"", ""BBQ grill"", ""Changing table"", ""Children\u2019s books and toys"", ""Dishwasher"", ""Iron"", ""Outlet covers"", ""Babysitter recommendations"", ""First aid kit"", ""Children\u2019s dinnerware"", ""Stove"", ""Essentials"", ""Free street parking"", ""Coffee maker"", ""Crib"", ""Pack \u2019n play/Travel crib"", ""Hair dryer"", ""Private entrance"", ""Fire extinguisher"", ""Lockbox""]",$425.00,t,06/03/2023,14/08/2012,19/02/2023,STR-0000192,f,491867,20200000000000.0,969518.0,2.0,3.0,37.77196,-122.43477,5.0,3.0,3.0,2.0,31.0,2.0,2.0,31.0,31.0,2.0,31.0,0.0,2.0,7.0,7.0,56.0,14.0,1.0,4.85,4.86,4.86,4.98,4.91,4.91,4.75,1.0,1.0,0.0,0.0,0.44
9,https://www.airbnb.com/rooms/144242,06/03/2023,city scrape,Lake Street Single Family Home,"Our full-time home (available when we are away), is your perfect place to call ""home base"" as you explore the city or visit friends.<br /><br /><b>The space</b><br />Great open floor plan home on a quiet tree lined street in one of San Francisco's most coveted neighborhoods.  Walking distance to the Presidio, Mountain Lake Park, Laurel Village, Sacramento St shopping and Golden Gate Park.  Easy walk to many cafes and restaurants.  <br /><br />The first level features a sunny gourmet kitchen with top-of-the-line appliances, open kitchen/dining area/family area, a lovely foyer, living room with flat panel TV/DirectTV, and a full bathroom with a large whirlpool soaking tub. There is also a small laundry room on this level. There is a deck off kitchen with a Weber grill and the small backyard features a  grassy area and patio seating.  The second floor has 3 BR's - 1st BR with a Queen Bed, 2nd BR has a full bed and 3rd BR has a twin bed + a twin trundle.  A pack-n-play is also available.  ",sin registro,https://a0.muscache.com/pictures/c175c400-edad-4e57-b669-ea74477df18f.jpg,https://www.airbnb.com/users/show/699215,Kate,14/06/2011,"San Francisco, CA","From San Francisco, California.  An active Airbnb Host.",within a few hours,90%,84%,t,https://a0.muscache.com/im/users/699215/profile_pic/1308032241/original.jpg?aki_policy=profile_small,https://a0.muscache.com/im/users/699215/profile_pic/1308032241/original.jpg?aki_policy=profile_x_medium,Richmond District,"['email', 'phone']",t,t,sin registro,Inner Richmond,Entire home,Entire home/apt,2.0,"[""Self check-in"", ""Cooking basics"", ""Shampoo"", ""Free parking on premises"", ""Pets allowed"", ""Smoke alarm"", ""Kitchen"", ""Carbon monoxide alarm"", ""TV with standard cable"", ""Washer"", ""Hot water"", ""Backyard"", ""Wifi"", ""Heating"", ""BBQ grill"", ""Iron"", ""Essentials"", ""Pack \u2019n play/Travel crib"", ""Coffee maker: Nespresso"", ""Hair dryer"", ""Fire extinguisher"", ""Dryer"", ""Lockbox""]",$545.00,t,06/03/2023,05/07/2011,02/01/2022,2022-011317STR,f,144242,20200000000000.0,699215.0,2.0,2.0,37.78546,-122.46148,6.0,3.0,3.0,3.0,60.0,3.0,3.0,60.0,60.0,3.0,60.0,6.0,6.0,6.0,64.0,22.0,0.0,0.0,4.86,4.95,4.89,5.0,5.0,4.89,4.95,1.0,1.0,0.0,0.0,0.15
13,https://www.airbnb.com/rooms/12041,06/03/2023,city scrape,Sunny/Sunset view room UCSF/USF - San Francisco,"Nice and good public transportation.  7 minutes walk to UCSF.  15 minutes walk to USF, ST Mary Hospital <br /><br />Room rental-sunny view room/sink/Wi Fi (inner sunset / UCSF) (map)<br /><br /><b>The space</b><br />Settle down, S.F. resident, student, hospital, job relocated, rotation. <br /><br />Monthly rental, short term staying - Nice public transportation location. <br /><br />No tourist or transient.  No pet no smoking no party inside the building.<br /><br />Medium private lock room(130 square feet) single person.<br /> <br />Large private lock room(190 square feet) single person.<br /><br />Extra large private room(230 square feet)  single person.<br /><br />Additional bed $20 per night.<br /><br />Surround by sunny view and good transportation. <br /><br />Room with sink(apartment style - shared large eat in kitchen/2 full & 2 half  bathrooms). Quiet house under management. <br /><br />Washer and Dryer (coins operated machine). <br /><br />Refrigerator and microwave are provi","N Juda Muni, Bus and UCSF Shuttle.<br /><br />UCSF campus and hospital, Shopping old town, restaurants, Golden Gate Park, <br /><br />Museums, Walgreen store, Haight street, Whole food, Safeway & Target stores.",https://a0.muscache.com/pictures/114583/240203ed_original.jpg,https://www.airbnb.com/users/show/21994,Aaron,17/06/2009,"San Francisco, CA","7 minutes walk to UCSF hospital & school campus.  15 minutes walk to USF, St. Mary Hospital.  5 minute walk to Golden Gate Park/Whole food/ regular food store and many different style restaurants & stores in stylish town.

Two ways public muni transportation in front the building to sunset areas/downtown/Golden Gate Bridge/Cal Train station/Airport.  Other 5 minutes walking distance bus stops to downtown and different areas.

Medium side room with one bed only . Extra large size of room with  one single or one full size bed only. The price just a little bit different but have more space. 

Please email your job offer letter and current official picture ID / acceptable credit report and score and financial information after you make reservation.  

Additional adult person  will be charged per night & One time standard cleaning fee $50  and  security deposit will be collected upon your arrival.   

Wi-Fi signal in common areas.   Large eat in kitchen.  Sunny sitting room.

Not pet/Not for any kinds of smoking/no party.  Quiet hours 8pm-9am

Simple cooking only, We have  cooktop and mini toaster oven with timer.   Refrigerator shared storage is limited and Whole Food supermarket in 7 minutes' walking distance.  Coin operated washer and dryer machine in the building.  No pet, No party, No smoking, not for any kinds of smoking, no candle, no tourist, no transient. 



",within an hour,100%,73%,f,https://a0.muscache.com/im/users/21994/profile_pic/1428380894/original.jpg?aki_policy=profile_small,https://a0.muscache.com/im/users/21994/profile_pic/1428380894/original.jpg?aki_policy=profile_x_medium,Cole Valley,"['email', 'phone']",t,t,"San Francisco, California, United States",Haight Ashbury,Private room in rental unit,Private room,3.0,"[""Carbon monoxide alarm"", ""Free street parking"", ""Security cameras on property"", ""Cooking basics"", ""Lock on bedroom door"", ""TV"", ""Host greets you"", ""Dedicated workspace"", ""Washer"", ""Hot water"", ""Refrigerator"", ""Private entrance"", ""Smoke alarm"", ""Fire extinguisher"", ""Dryer"", ""Wifi"", ""Heating"", ""Kitchen""]",$65.00,t,06/03/2023,18/09/2011,11/06/2022,sin registro,f,12041,20200000000000.0,21994.0,1.9,3.3,37.76901,-122.44701,2.0,1.0,2.0,32.0,120.0,32.0,32.0,120.0,120.0,32.0,120.0,30.0,60.0,90.0,365.0,7.0,1.0,0.0,4.8,4.9,4.8,4.9,4.86,4.57,4.7,1.4,1.0,0.4,0.0,0.05
16,https://www.airbnb.com/rooms/147443,06/03/2023,city scrape,Best Views in all of San Francisco,"The perfect place to enjoy VIEWS atop Noe Valley, the most central location within San Francisco. This 2nd story walk-up unit has hardwood floors, recessed lights w/ dimmers, large empty closets, and luxury bathrooms. Free HD Cable with DVR and HBO. Free high speed wifi. Huge sunny patio w/ hammock, sun lounger and zen rock garden. [DISCLAIMER: In extenuating circumstances, you may be asked to move to a newly renovated 3rd story unit w/ same interior floor plan.]<br /><br /><b>The space</b><br />**THANK YOU AIRBNB FOR RANKING US THE #1 LISTING FOR OUR NEIGHBORHOOD IN ALL OF SAN FRANCISCO**<br /><br />Make this modern view 2 bedroom 1.5 bath apartment your private sanctuary during your trip to San Francisco. Located just across the street from City View Place, a well known Vista Point at the top of Noe Valley, it's a safe, modern and serene, 1200-square-foot  apartment equipped with top-notch amenities throughout.<br /><br />For larger groups, there is an additional ground floor in-law ","If you are interested in exploring the neighborhood around the Vista Point, it's a short 10 minute walk down the hill to the many shops and restaurants located along 24th Street in the heart of Noe Valley all the way to the hip and trendy Mission district.<br /><br />Just up the hill, Twin Peaks is a breath-taking neighborhood that rises above the rest (literally!). Occupying two of San Franciscoâ€™s highest summits, Twin Peaks offers quiet seclusion from the city below. The neighborhoodâ€™s high altitude location may remove it from hurried urban activity, but the steep descent from its hilltops is made worth it by Twin Peaksâ€™ sweeping San Francisco vistas.",https://a0.muscache.com/pictures/2843751/5fd2dd56_original.jpg,https://www.airbnb.com/users/show/709325,Mark,16/06/2011,"San Francisco, CA","I am an avid traveler and have visited more than 30 international cities and countries in the States, Europe, North, Central and South America, and Asia. This enjoyment has served as an inspiration for me to design places with every amenity and convenience to other frequent travelers like myself.",within an hour,100%,100%,f,https://a0.muscache.com/im/users/709325/profile_pic/1345783770/original.jpg?aki_policy=profile_small,https://a0.muscache.com/im/users/709325/profile_pic/1345783770/original.jpg?aki_policy=profile_x_medium,Diamond Heights,"['email', 'phone']",t,t,"San Francisco, California, United States",Diamond Heights,Entire rental unit,Entire home/apt,1.5,"[""Oven"", ""Self check-in"", ""Cooking basics"", ""Shampoo"", ""Smoke alarm"", ""Kitchen"", ""Bed linens"", ""Carbon monoxide alarm"", ""Dishes and silverware"", ""Hangers"", ""Bathtub"", ""Dedicated workspace"", ""TV with standard cable"", ""Washer"", ""Hot water"", ""Refrigerator"", ""Microwave"", ""Shared patio or balcony"", ""Backyard"", ""Wifi"", ""Heating"", ""Long term stays allowed"", ""BBQ grill"", ""Dishwasher"", ""Private hot tub"", ""Iron"", ""First aid kit"", ""Stove"", ""Indoor fireplace"", ""City skyline view"", ""Essentials"", ""Free street parking"", ""Coffee maker"", ""Bay view"", ""Hair dryer"", ""Fire extinguisher"", ""Dryer"", ""Lockbox""]",$167.00,t,06/03/2023,02/07/2011,30/09/2022,STR-0000672,f,147443,20200000000000.0,709325.0,6.0,3.3,37.74633,-122.44591,4.0,2.0,3.0,30.0,180.0,30.0,30.0,180.0,180.0,30.0,180.0,0.0,0.0,0.0,262.0,112.0,2.0,0.0,4.6,4.78,4.5,4.78,4.78,4.64,4.59,1.4,1.0,0.0,0.0,0.79
