250,https://www.airbnb.com/rooms/1198464,06/03/2023,city scrape,Fabulous Blue Safe+clean+Parking+OceanView 3 Bath,"COVID-19 vaccine mandatory home!<br />Daily sanitized common spaces using disinfectants approved by global health agencies. Hand sanitizer provided at the door. <br />Guaranteed parking, three shared impeccably clean bathrooms, a spotless clean house and a safe environment.<br />All illegal stuff free home<br />NO: shoes, no locks/no cooking/no parties/no pets/no young children, no visitors, no wandering around, no deck access.<br />We have more than 5 listings but we ONLY use 5 listings maximum at ANY given time<br /><br /><b>The space</b><br />In these terrible times of coronavirus we pray for us all and our world as we ensure to do our part taking daily disinfecting precautions and safety procedures.<br /><br />The walls in our houses in San Francisco are made of wood for earthquake safety measures so our homes do not have good sound proof making it imperative for you<br />- to wear your headphones at all times and to lower your regular tone of voice as much as possible as due to Co","Our neighborhood is safe, beautiful and greatly located in the city San Francisco. We face the Pacific ocean in a very low key and private neighborhood. People can walk in our streets at any time, day or night without any problems.<br />This is a family home and we live here, we try with all our hearts to do our best. We might have other guests here thus we are not responsible for any issues you might encounter with them and are not responsible for any lost, stolen or damage things of yours. We never had an issue so far these 7+ years here.",https://a0.muscache.com/pictures/5b6d2bf4-b47e-49d9-bcbe-f13943d66583.jpg,https://www.airbnb.com/users/show/5565510,Lulu,21/03/2013,"San Francisco, CA","I am delighted to share my home and wholeheartedly welcome people that honor their word when they agree to my house-rules prior booking. COVID chaotic guests disrupting our lives terribly made us suffer more than enough. I speak with ten years experience. Prior COVID I have served breakfast and dinner every day and I am sad that I canâ€™t do it anymore but the heart the love and the overall integrity is intact. 
If you know few things about Lebanese people, as I am one, family, values, generosity, insecurity, our priorities in our lives. That is what you will have in my home, a precious place that I have been living and growing with my children and hundreds of plants and trees for the last 29 yearsâ¤ï¸
We all live great lives, I am a designer/manufacturer working in China since the 90s so it makes it impossible  to continue easily when anyone with special needs or hotel mentality book our bedrooms. Please make sure to understand that I run an extremely tight ship and have eyes on every detail. We attend all matters immediately not only caring for all and everything but to make sure that issues are stoped before they begin.
Our home and neighborhood are extremely safe and as a designer with three amazingly gifted hard working adult children, we have designed this Jungle/Museum/Doll House and sanctuary. Clean air and environment, clean bathrooms and bedrooms are what awaits you, so welcome and enjoy these walls that express what I envision in my heart and soul as beautiful, all blending with art from different countries and periods in history, plants and colorsâ¤ï¸ 

We are super blessed and protected by a team of four fantastic Christian humans that work for us and help us keep it all magnificently well and clean for over sixteen years, that trust and security is PRICELESS and if it is the Lordâ€™s will, it will be yours too.
Our home faces the Pacific Ocean, about 50 blocks away and when it is not foggy, our sunsets are dream-like! That said, the fog crawls up from the ocean and literally sits on top of our homes and neighborhood most of the time, specially during the summer, thus, I cannot express enough the importance the travel accordingly.
There will probably be other guests like you during your stay so we ask to whisper between 8 PM and 10 in the morning and if youâ€™re going to be on the phone, you absolutely have to wear your headphones. Equally important is to notice that to enjoy good internet, as we all work online, we will ask that you choose ONE device for Wifi access. 

In order to keep control of all details, my children and I personally are constantly here to help, explain and be of any assistance to you all, so to be informed of any and all needs you might have: we WILL TRULY do our maximum to accommodate you so always let US KNOW what you need, please!

In as much as the prices in our listings are concerned, we are happy to offer a rate that is at least 60% off in comparison to our  neighbors because we are blessed enough so love to share!

I, the lucky mom and house owner, Lulu, speak eight languages, studying my ninth now and I am fortunate enough to travel around the world for business.

We look forward to sharing our lives with yâ€™all! 
FYI, I go by â€œMamaLuâ€ but my very favorite nickname is the â€œCreature From The Forestâ€ :D
Welcome!
MamaLu",within a few hours,100%,79%,f,https://a0.muscache.com/im/pictures/user/e8dab711-5f18-473c-b963-254400531bd6.jpg?aki_policy=profile_small,https://a0.muscache.com/im/pictures/user/e8dab711-5f18-473c-b963-254400531bd6.jpg?aki_policy=profile_x_medium,Balboa Terrace,"['email', 'phone']",t,t,"San Francisco, California, United States",West of Twin Peaks,Private room in home,Private room,3.0,"[""Security cameras on property"", ""Shampoo"", ""Host greets you"", ""Mini fridge"", ""Smoke alarm"", ""Kitchen"", ""Bed linens"", ""Carbon monoxide alarm"", ""Extra pillows and blankets"", ""Hangers"", ""Body soap"", ""Dedicated workspace"", ""Microwave"", ""Hot water"", ""Refrigerator"", ""Wifi"", ""Heating"", ""Long term stays allowed"", ""Hot water kettle"", ""First aid kit"", ""Toaster"", ""Safe"", ""Essentials"", ""Free street parking"", ""Conditioner"", ""Fire extinguisher""]",$46.00,t,06/03/2023,14/08/2013,15/06/2022,STR-0001386,f,1198464,20200000000000.0,5565510.0,5.0,3.3,37.73386,-122.4638,2.0,1.0,1.0,5.0,30.0,5.0,5.0,30.0,30.0,5.0,30.0,25.0,55.0,74.0,344.0,118.0,1.0,0.0,4.61,4.81,4.78,4.9,4.85,4.78,4.68,1.4,1.0,0.4,0.0,1.01
256,https://www.airbnb.com/rooms/78651,06/03/2023,city scrape,Heart of the Mission: Hot spot,"Welcome to our home! You will be living with Seb and I as well as 2 other roommates. We are proud to have been hosting with Airbnb since 2010; we've built a community of current and returning guests.   Minimum stay is 30 days.<br /><br /><b>The space</b><br />Welcome to the Mission and to our home. Our home is located on a quiet side street between two of the busiest streets in San Francisco's Mission District (Valencia and Mission Streets). We are two blocks from BART, one block from several major bus lines. You can be downtown (from out the door here via BART) in about 15 minutes.<br /><br />I live here in the back of the apartment so it is very important to me that when you request to stay with us that you have a complete profile, meaning a picture or two of yourself, talk about the purpose of your visit, and have some references.  <br /><br />This is foodie heaven. We are within a block of Ritual Coffee, Dosa, Foreign Cinema, Aquarius Records, Revolution Cafe, and the Makeout Room.",sin registro,https://a0.muscache.com/pictures/12356728/f2f7be13_original.jpg,https://www.airbnb.com/users/show/142882,Jessica And Sebouh,12/06/2010,"San Francisco, CA","Seb and I have been hosting guests on Airbnb since 2010. We have a 3 year old baby.  I work as a psychologist with kids and spend weekends working in my garden, cooking, relaxing around the neighborhood. I have lived in the Mission for last 18 years and love talking about the neighborhood, world travels and good places to eat. I have lived abroad in East Africa and traveled in Europe and Central/South America. I love learning about new places to visit, especially coastal spots and warm spots, and trying new foods.  Our profile pictures are shots of us traveling in Mexico, Spain, France and Armenia.

We live in this apartment too, so you will see us hanging out in the kitchen and common areas.  Our bedroom is towards the back of the house, while the three guest rooms are in the front of the house.  I try to balance visiting with guests and having alone time.  The house tends to be pretty quiet and mellow. We specifically do not rent to couples so that there are a max of three guests at any time.
Sebouh lives downstairs and you will see him occasionally. He speaks fluent Armenian and is a plumber and works out of our house, so he comes and goes throughout the day. ",a few days or more,0%,0%,f,https://a0.muscache.com/im/users/142882/profile_pic/1414130558/original.jpg?aki_policy=profile_small,https://a0.muscache.com/im/users/142882/profile_pic/1414130558/original.jpg?aki_policy=profile_x_medium,Mission District,"['email', 'phone']",t,t,sin registro,Mission,Private room in rental unit,Private room,2.0,"[""Essentials"", ""Carbon monoxide alarm"", ""Shampoo"", ""Lock on bedroom door"", ""Host greets you"", ""TV with standard cable"", ""Paid parking off premises"", ""Hot water"", ""Hair dryer"", ""First aid kit"", ""Smoke alarm"", ""Fire extinguisher"", ""Private entrance"", ""Wifi"", ""Heating"", ""Kitchen""]",$85.00,t,06/03/2023,05/06/2011,25/10/2019,STR-0000875,f,78651,20200000000000.0,142882.0,2.0,4.0,37.75585,-122.42081,1.0,1.0,1.0,30.0,360.0,30.0,30.0,360.0,360.0,30.0,360.0,30.0,60.0,90.0,365.0,92.0,0.0,0.0,4.73,4.73,4.38,4.89,4.89,4.78,4.65,2.0,1.0,2.0,0.0,0.64
258,https://www.airbnb.com/rooms/1212746,06/03/2023,city scrape,Big Flat/3 BR/2-Bath/Great District/Near Subway,"Very large 3-Br 2-bath flat, full kitchen, 6 person breakfast nook, big living room with queen sofa/futon, round dinning table & door for privacy so it could be used as sleeping room. It's kept very clean, has lots of natural light. Central location, great neighborhood. 2 blocks/100m to supermarket, close to public transit, 7 minute walk to subway station.  2 bedrooms have queen-sized beds, 3rd bedroom has 1 queen bed & 2 single beds available to set up. Enjoy comforts of home & weekly cleaning.<br /><br /><b>The space</b><br />My flat has 3 large bedrooms and 2 bathrooms, a fully equipped kitchen with dishes, flatware and pots & pans for cooking.  There's a separate breakfast nook off of kitchen. The big living room has a sofa futon, a round dining table that seats 8 people and a door that can be closed for privacy so it can be used as private sleeping room.  My home is furnished beautifully, I keep it impeccably clean.  I provide towels and bed linens and included in price is  weekly","Centrally located in Castro district of San Francisco, called a walker's paradise, with a rating of 97 by walkscore.  There's a major grocery store located 500 ft /200 m from the flat.  Two blocks down you'll find a U.S. Post office, full service cleaners (wash & fold & dry clean), a few blocks away there a major drug store, hardware store, health food store, coffee shops, ice cream shops, several restaurants and bars as well as a variety of gift shops and specialty stores and beautiful historic homes.",https://a0.muscache.com/pictures/62ab8794-e7df-4d2b-8445-a4d1cce2cf39.jpg,https://www.airbnb.com/users/show/1237762,Myles,02/10/2011,"San Francisco, CA","I am a warm and friendly person and I enjoy meeting people. Although I'm not a native to SF, I call this wonderful city home and I have enjoyed all that it has to offer to residents and tourists alike for over three decades.

My place offers guests the ability to enjoy the familiar comforts and conveniences of home while on vacation or on a business trip.

Hosting and meeting people from all over the world has been a great experience as I enjoy sharing my favorites places to visit and my favorite things to do in the city by the bay.

In my free time I enjoy cooking and baking, gardening, getting together with friends, watching old movies and TV mysteries,  visiting special museums exhibits, cooking and entertaining friends and family, the theater, eating out and spending time with my family.  One of my favorite vacation spots is Kauai and it try to spend a week there every year.

I do my best to make sure that as my guest, you have a comfortable and enjoyable stay in this world-famous city.  Come stay with me, you'll love it!",sin registro,sin registro,100%,t,https://a0.muscache.com/im/pictures/user/b328b625-5e66-4685-84f5-72721bd0d8d6.jpg?aki_policy=profile_small,https://a0.muscache.com/im/pictures/user/b328b625-5e66-4685-84f5-72721bd0d8d6.jpg?aki_policy=profile_x_medium,The Castro,"['email', 'phone']",t,f,"San Francisco, California, United States",Castro/Upper Market,Entire rental unit,Entire home/apt,2.0,"[""Oven"", ""Security cameras on property"", ""Self check-in"", ""Cooking basics"", ""Luggage dropoff allowed"", ""Shampoo"", ""Smoke alarm"", ""Kitchen"", ""Carbon monoxide alarm"", ""Dishes and silverware"", ""Hangers"", ""Bathtub"", ""Fireplace guards"", ""Smart lock"", ""Microwave"", ""Hot water"", ""Refrigerator"", ""Backyard"", ""Wifi"", ""Heating"", ""Dishwasher"", ""Iron"", ""32\"" TV"", ""Indoor fireplace: wood-burning"", ""First aid kit"", ""Stove"", ""Essentials"", ""Free street parking"", ""Coffee maker"", ""Hair dryer"", ""Fire extinguisher"", ""Single level home""]",$625.00,t,06/03/2023,29/07/2013,13/01/2023,STR-0004719,f,1212746,20200000000000.0,1237762.0,2.0,5.0,37.76018,-122.4402,3.0,3.0,3.0,2.0,29.0,2.0,3.0,29.0,29.0,2.4,29.0,29.0,59.0,89.0,363.0,120.0,12.0,0.0,4.87,4.84,4.92,4.96,4.95,4.88,4.69,2.0,1.0,1.0,0.0,1.03
261,https://www.airbnb.com/rooms/1212822,06/03/2023,city scrape,"""Designer  Showplace  Home""  in the Marina","Beautiful Mediterranean sunny bright cosy spacious elegant 3 bedrooms, 2 baths apartment in charming quaint Marina District. Located 1 block from the Palace of Fine Arts, St.Francis Yacht Club, beach & 5 blocks to Chestnut Street buzzing with restaurants, bars, boutiques, cafes/bakeries, banks etc. 5 minutes walk to great hiking trails. Walking distance to: Golden Gate Bridge, Fort Point, Fort Mason, Presidio Park, Disney Museum, Union & Polk Streets, Fisherman's Wharf, China town, Union Square.<br /><br /><b>The space</b><br />This is a beautiful bright 3 bedroom, 2 bath apartment in the heart of the charming quaint Marina, located 1 block from the Palace of Fine Arts, Saint Francis Yacht Club, Crissy Field Beach (famous for windsurfing). Walking distance to Golden Gate Bridge, Fort Point, Presidio Park, Fort Mason, Ghirardelli Square, little Italy, Russian Hill, Union Square & Fisherman's wharf. Beautiful trails along the beach and parks. This is known to be one of the absolute best,","The neighborhood is quiet, friendly, sunny and light, located one block from the Palace of Fine Arts, the St Francis Yacht Club, Crissy Field Beach (famous for windsurfing) and is also walking distance to the Golden Gate Bridge, Presidio Park, Walt Disney's museum, hiking trails, Fort Point and Fisherman's wharf. This is known to be one of the nicest neighborhood in the city. <br />Few blocks away are, the buzzing Chestnut and Union Streets, fun friendly shopping areas filled with cafes, restaurants, bars, delis, market, banks, pharmacies, boutiques, theaters and bus stops for transportation all over the city.",https://a0.muscache.com/pictures/15bc9eee-2439-44d0-b068-2f8697f30764.jpg,https://www.airbnb.com/users/show/1700823,Jennifer,05/02/2012,"San Francisco, CA","I am from the Mediterranean area and have been an artist all my life . I am an interior designer and a real estate agent working with Keller Williams. 
I am professional, hospitable, very quiet, non smoker, extremely clean, open minded, athletic, social, interested in the arts, real estate and business.
I love nature and outdoor activities. I snow ski, swim, hike, bike, dance, cook, draw and paint. I enjoy watching movies such as: Like Water for Chocolate, Chocolat, Les Intouchables, Gladiator, Braveheart, The Lion King, ET, Avatar, Pretty Woman, Shawshanck Redemption, The last of the Mohicans, Pride & Prejudice, the history channels, documentaries, etc... 
I am sociable, outgoing, hospitable, love good conversation and great food. I traveled extensively around the world and lived abroad. Since my teens, I try each year, to discover one or 2 new cities or countries. I enjoy learning and discovering new cultures as I appreciate people and the world.
Some of the main countries I have visited in Europe, South America, Central and North America including the Arab World are:
 France, England, Italy, Germany, Austria, Sweden , Denmark, Portugal, Spain, Basque, Greece, Cypress, Turkey,  Lebanon, Jordan, Syria, United Arab Emirates, Israel, Morocco and the Sahara desert. 
I also traveled throughout the Caribbean, Central America and visited Peru, Ecuador and Indonesia. 
It is my pleasure to welcome you to my home and make it: ""Your Home away from Home""",within an hour,100%,100%,f,https://a0.muscache.com/im/users/1700823/profile_pic/1388681111/original.jpg?aki_policy=profile_small,https://a0.muscache.com/im/users/1700823/profile_pic/1388681111/original.jpg?aki_policy=profile_x_medium,Marina,"['email', 'phone']",t,t,"San Francisco, California, United States",Marina,Entire condo,Entire home/apt,2.0,"[""Oven"", ""Cooking basics"", ""Luggage dropoff allowed"", ""Shampoo"", ""Host greets you"", ""Dining table"", ""Beach access"", ""Free dryer \u2013 In unit"", ""Paid parking off premises"", ""Pets allowed"", ""Smoke alarm"", ""Room-darkening shades"", ""Free washer \u2013 In unit"", ""Kitchen"", ""Bed linens"", ""Carbon monoxide alarm"", ""Dishes and silverware"", ""Extra pillows and blankets"", ""Hangers"", ""Bathtub"", ""Clothing storage: closet"", ""Body soap"", ""Laundromat nearby"", ""Microwave"", ""Hot water"", ""Refrigerator"", ""Backyard"", ""Private patio or balcony"", ""Wifi"", ""Heating"", ""Paid parking garage on premises \u2013 1 space"", ""Ethernet connection"", ""Long term stays allowed"", ""Freezer"", ""Shower gel"", ""Children\u2019s books and toys"", ""Iron"", ""Dishwasher"", ""Outdoor dining area"", ""Hot water kettle"", ""First aid kit"", ""Stove"", ""Trash compactor"", ""40\"" TV"", ""Books and reading material"", ""City skyline view"", ""Toaster"", ""Portable fans"", ""Essentials"", ""Rice maker"", ""Coffee maker"", ""Free street parking"", ""Wine glasses"", ""Outdoor furniture"", ""Elevator"", ""Cleaning products"", ""Conditioner"", ""Hair dryer"", ""Private entrance"", ""Fire extinguisher""]",$310.00,t,06/03/2023,06/08/2013,22/02/2023,STR-0001083,f,1212822,20200000000000.0,1700823.0,2.0,5.0,37.80494,-122.44457,5.0,3.0,3.0,30.0,730.0,30.0,30.0,1125.0,1125.0,30.0,1125.0,0.0,0.0,0.0,4.0,42.0,2.0,1.0,4.88,4.9,4.88,4.83,4.88,5.0,4.76,2.0,1.0,0.0,0.0,0.36
263,https://www.airbnb.com/rooms/1245838,06/03/2023,city scrape,Fantastic Family Home with Beautiful Backyard,"<b>The space</b><br />This newly remodeled flat with 3 bedrooms, backyard and attached garage is the perfect family getaway.  Spacious and airy kitchen with stainless steel appliances and Viking range.  Wi-fi, flatscreen TV, and Comcast DVR with 300 channels.  <br /><br />On the lower level is a large open sitting room with a custom comfortable sofa bed with a memory foam mattress, no springs. This room has large french doors that open onto an outdoor patio with fountain.  Attached to this room is a beautiful zen bathroom with travertine tiles, overhead rain shower and large jaquzzi tub. Next to the sitting room is a cozy bedroom with king memory foam bed, blackout shades and built in fan for white nose and radiant floor heating making it the perfect sleeping room. <br /><br />Upstairs along with kitchen, family room and bathroom there are two bedrooms, one with a queen bed and desk and across the hall another with a twin trundle bed with a large bay window.  You and your kids can also",sin registro,https://a0.muscache.com/pictures/f749c62c-24c7-4db3-8c35-b3d0cfc6aebb.jpg,https://www.airbnb.com/users/show/6789170,Nicole,07/06/2013,"San Francisco, CA",We are an active family of 5 who loves to travel and play sports especially tennis and baseball.  We love living in San Francisco where there is such rich culture and diversity in addition to so many new restaurants to try and adventures to be had.  ,within a day,88%,55%,t,https://a0.muscache.com/im/pictures/user/5cd2d876-7c4c-4b9b-a63d-0011e9816717.jpg?aki_policy=profile_small,https://a0.muscache.com/im/pictures/user/5cd2d876-7c4c-4b9b-a63d-0011e9816717.jpg?aki_policy=profile_x_medium,Bernal Heights,"['email', 'phone']",t,t,sin registro,Bernal Heights,Entire rental unit,Entire home/apt,2.0,"[""Oven"", ""Self check-in"", ""Cooking basics"", ""Blender"", ""Shampoo"", ""Dining table"", ""Free parking on premises"", ""Smoke alarm"", ""Baking sheet"", ""Patio or balcony"", ""Barbecue utensils"", ""Kitchen"", ""Carbon monoxide alarm"", ""Dishes and silverware"", ""Hangers"", ""Bathtub"", ""Dedicated workspace"", ""TV with standard cable"", ""Washer"", ""Hot water"", ""Refrigerator"", ""Microwave"", ""Wifi"", ""Heating"", ""Keypad"", ""BBQ grill"", ""Freezer"", ""Dishwasher"", ""Iron"", ""Private backyard \u2013 Fully fenced"", ""Hot water kettle"", ""First aid kit"", ""Stove"", ""Toaster"", ""Portable fans"", ""Essentials"", ""Free street parking"", ""Baby safety gates"", ""Coffee maker"", ""Wine glasses"", ""Pack \u2019n play/Travel crib"", ""Outdoor furniture"", ""Game console"", ""Hair dryer"", ""Private entrance"", ""Fire extinguisher"", ""Dryer""]",$411.00,t,06/03/2023,10/08/2013,01/01/2023,STR-0000906,f,1245838,20200000000000.0,6789170.0,2.0,2.0,37.73483,-122.41838,7.0,3.0,1.6,3.0,21.0,3.0,3.0,21.0,21.0,3.0,21.0,0.0,0.0,0.0,68.0,44.0,5.0,0.0,4.82,4.73,4.75,4.82,4.86,4.82,4.66,1.0,1.0,0.0,0.0,0.38
264,https://www.airbnb.com/rooms/1265074,06/03/2023,city scrape,Spacious SF Home with Garden and Sunset Views,"Beautiful home in Golden Gate Heights with stunning views and spacious garden, perfect for isolating yourself from the bustling city life. This home features: - Living Room with decorative fireplace - Formal Dining Room - Kitchen with refrigerator, gas stove, dishwasher and disposal - Kitchen and Breakfast Room - 3 Bedrooms - 2 Full Bathrooms - newly refinished Hardwood floors - Washer & Dryer in garage laundry area - 1 Parking Space in the garage and 1 space on driveway - Storage in the garage<br /><br /><b>The space</b><br />This beautiful home possesses the charm and architectural details of the period and a great floor plan. Newly painted inside and out, and newly refinished Hardwood floors. The living room has a stunning west view of the Sunset District, with a glimpse of the ocean, perfect for watching sunsets with a book and coffee in hand. The large windows and high ceilings  light up the house and make it feel very spacious. The house is remarkably quiet. Located near Golden G","Located in desirable Golden Gate Heights, a quiet neighborhood just minutes away from Ocean Beach,  shopping, restaurants and Golden Gate Park. Close to UCSF Medical Center, SFSU, SF City College and just a little farther to USF. Nearby Elementary school is Clarendon. Various public libraries within a 1 mile radius.",https://a0.muscache.com/pictures/91e0fe01-e57a-4363-babb-ddaf3cd3731f.jpg,https://www.airbnb.com/users/show/6887723,Mariel,13/06/2013,sin registro,sin registro,within an hour,100%,100%,f,https://a0.muscache.com/im/users/6887723/profile_pic/1376372035/original.jpg?aki_policy=profile_small,https://a0.muscache.com/im/users/6887723/profile_pic/1376372035/original.jpg?aki_policy=profile_x_medium,Inner Sunset,"['email', 'phone']",t,t,"San Francisco, California, United States",Inner Sunset,Entire home,Entire home/apt,2.0,"[""Self check-in"", ""Window guards"", ""Cooking basics"", ""32\"" HDTV with Chromecast"", ""Dining table"", ""Free dryer \u2013 In unit"", ""Smoke alarm"", ""Frigidaire stainless steel gas stove"", ""Room-darkening shades"", ""Coffee maker: drip coffee maker, french press, pour-over coffee"", ""Coffee"", ""Free washer \u2013 In unit"", ""Garden view"", ""Bed linens"", ""Carbon monoxide alarm"", ""Kitchen"", ""Dishes and silverware"", ""Extra pillows and blankets"", ""Hangers"", ""Children\u2019s books and toys for ages 5-10 years old and 10+ years old"", ""Bathtub"", ""Clothing storage: closet"", ""Dove neutral body soap"", ""Dedicated workspace"", ""Laundromat nearby"", ""Hot water"", ""Refrigerator"", ""Private patio or balcony"", ""Ocean view"", ""Wifi"", ""Ethernet connection"", ""Central heating"", ""Frigidaire  oven"", ""Long term stays allowed"", ""Freezer"", ""Dishwasher"", ""Iron"", ""Private backyard \u2013 Fully fenced"", ""Hot water kettle"", ""First aid kit"", ""Trash compactor"", ""Books and reading material"", ""City skyline view"", ""Toaster"", ""Public or shared beach access"", ""Essentials"", ""Free street parking"", ""Wine glasses"", ""Free parking garage on premises \u2013 1 space"", ""Hair dryer"", ""Private entrance"", ""Fire extinguisher"", ""Lockbox""]",$215.00,t,06/03/2023,05/07/2021,04/12/2022,sin registro,f,1265074,20200000000000.0,6887723.0,1.0,4.0,37.75135,-122.47282,6.0,3.0,3.0,30.0,144.9,30.0,30.0,1125.0,1125.0,30.0,1125.0,0.0,5.0,35.0,309.0,5.0,3.0,0.0,4.8,4.8,5.0,5.0,5.0,5.0,5.0,1.0,1.0,0.0,0.0,0.25
